01:55:03.618821 IP 10.20.0.5.ssh > ip-45-74-123-101.user.start.ca.55341: Flags [P.], seq 1960360:1960532, ack 1045, win 501, length 172
01:55:03.618902 IP 10.20.0.5.ssh > ip-45-74-123-101.user.start.ca.55341: Flags [P.], seq 1960532:1960704, ack 1045, win 501, length 172
01:55:03.618984 IP 10.20.0.5.ssh > ip-45-74-123-101.user.start.ca.55341: Flags [P.], seq 1960704:1960876, ack 1045, win 501, length 172
01:55:03.619067 IP 10.20.0.5.ssh > ip-45-74-123-101.user.start.ca.55341: Flags [P.], seq 1960876:1961048, ack 1045, win 501, length 172
01:55:03.619147 IP 10.20.0.5.ssh > ip-45-74-123-101.user.start.ca.55341: Flags [P.], seq 1961048:1961220, ack 1045, win 501, length 172
01:55:03.619228 IP 10.20.0.5.ssh > ip-45-74-123-101.user.start.ca.55341: Flags [P.], seq 1961220:1961392, ack 1045, win 501, length 172
01:55:03.619313 IP 10.20.0.5.ssh > ip-45-74-123-101.user.start.ca.55341: Flags [P.], seq 1961392:1961564, ack 1045, win 501, length 172
01:55:03.619394 IP 10.20.0.5.ssh > ip-45-74-123-101.user.start.ca.55341: Flags [P.], seq 1961564:1961736, ack 1045, win 501, length 172
01:55:03.619474 IP 10.20.0.5.ssh > ip-45-74-123-101.user.start.ca.55341: Flags [P.], seq 1961736:1961908, ack 1045, win 501, length 172
01:55:03.619557 IP 10.20.0.5.ssh > ip-45-74-123-101.user.start.ca.55341: Flags [P.], seq 1961908:1962080, ack 1045, win 501, length 172
01:55:03.619639 IP 10.20.0.5.ssh > ip-45-74-123-101.user.start.ca.55341: Flags [P.], seq 1962080:1962252, ack 1045, win 501, length 172
01:55:03.619724 IP 10.20.0.5.ssh > ip-45-74-123-101.user.start.ca.55341: Flags [P.], seq 1962252:1962424, ack 1045, win 501, length 172
01:55:03.619805 IP 10.20.0.5.ssh > ip-45-74-123-101.user.start.ca.55341: Flags [P.], seq 1962424:1962596, ack 1045, win 501, length 172
01:55:03.619886 IP 10.20.0.5.ssh > ip-45-74-123-101.user.start.ca.55341: Flags [P.], seq 1962596:1962768, ack 1045, win 501, length 172
01:55:03.619971 IP 10.20.0.5.ssh > ip-45-74-123-101.user.start.ca.55341: Flags [P.], seq 1962768:1962940, ack 1045, win 501, length 172
01:55:03.620052 IP 10.20.0.5.ssh > ip-45-74-123-101.user.start.ca.55341: Flags [P.], seq 1962940:1963112, ack 1045, win 501, length 172
01:55:03.620165 IP 10.20.0.5.ssh > ip-45-74-123-101.user.start.ca.55341: Flags [P.], seq 1963112:1963284, ack 1045, win 501, length 172
01:55:03.620256 IP 10.20.0.5.ssh > ip-45-74-123-101.user.start.ca.55341: Flags [P.], seq 1963284:1963456, ack 1045, win 501, length 172
01:55:03.620344 IP 10.20.0.5.ssh > ip-45-74-123-101.user.start.ca.55341: Flags [P.], seq 1963456:1963628, ack 1045, win 501, length 172
01:55:03.620428 IP 10.20.0.5.ssh > ip-45-74-123-101.user.start.ca.55341: Flags [P.], seq 1963628:1963800, ack 1045, win 501, length 172
01:55:03.620508 IP 10.20.0.5.ssh > ip-45-74-123-101.user.start.ca.55341: Flags [P.], seq 1963800:1963972, ack 1045, win 501, length 172
01:55:03.620591 IP 10.20.0.5.ssh > ip-45-74-123-101.user.start.ca.55341: Flags [P.], seq 1963972:1964144, ack 1045, win 501, length 172
01:55:03.620676 IP 10.20.0.5.ssh > ip-45-74-123-101.user.start.ca.55341: Flags [P.], seq 1964144:1964316, ack 1045, win 501, length 172
01:55:03.620757 IP 10.20.0.5.ssh > ip-45-74-123-101.user.start.ca.55341: Flags [P.], seq 1964316:1964488, ack 1045, win 501, length 172
01:55:03.620842 IP 10.20.0.5.ssh > ip-45-74-123-101.user.start.ca.55341: Flags [P.], seq 1964488:1964660, ack 1045, win 501, length 172
01:55:03.620923 IP 10.20.0.5.ssh > ip-45-74-123-101.user.start.ca.55341: Flags [P.], seq 1964660:1964832, ack 1045, win 501, length 172
01:55:03.621004 IP 10.20.0.5.ssh > ip-45-74-123-101.user.start.ca.55341: Flags [P.], seq 1964832:1965004, ack 1045, win 501, length 172
01:55:03.621093 IP 10.20.0.5.ssh > ip-45-74-123-101.user.start.ca.55341: Flags [P.], seq 1965004:1965176, ack 1045, win 501, length 172
01:55:03.621176 IP 10.20.0.5.ssh > ip-45-74-123-101.user.start.ca.55341: Flags [P.], seq 1965176:1965348, ack 1045, win 501, length 172
01:55:03.621258 IP 10.20.0.5.ssh > ip-45-74-123-101.user.start.ca.55341: Flags [P.], seq 1965348:1965520, ack 1045, win 501, length 172
01:55:03.621348 IP 10.20.0.5.ssh > ip-45-74-123-101.user.start.ca.55341: Flags [P.], seq 1965520:1965692, ack 1045, win 501, length 172
01:55:03.621429 IP 10.20.0.5.ssh > ip-45-74-123-101.user.start.ca.55341: Flags [P.], seq 1965692:1965864, ack 1045, win 501, length 172
01:55:03.621508 IP 10.20.0.5.ssh > ip-45-74-123-101.user.start.ca.55341: Flags [P.], seq 1965864:1966036, ack 1045, win 501, length 172
01:55:03.621587 IP 10.20.0.5.ssh > ip-45-74-123-101.user.start.ca.55341: Flags [P.], seq 1966036:1966208, ack 1045, win 501, length 172
01:55:03.621667 IP 10.20.0.5.ssh > ip-45-74-123-101.user.start.ca.55341: Flags [P.], seq 1966208:1966380, ack 1045, win 501, length 172
01:55:03.621749 IP 10.20.0.5.ssh > ip-45-74-123-101.user.start.ca.55341: Flags [P.], seq 1966380:1966552, ack 1045, win 501, length 172
01:55:03.621807 IP ip-45-74-123-101.user.start.ca.55341 > 10.20.0.5.ssh: Flags [.], ack 1944648, win 511, length 0
01:55:03.622008 IP 10.20.0.5.ssh > ip-45-74-123-101.user.start.ca.55341: Flags [P.], seq 1966552:1966844, ack 1045, win 501, length 292
01:55:03.622150 IP 10.20.0.5.ssh > ip-45-74-123-101.user.start.ca.55341: Flags [P.], seq 1966844:1967016, ack 1045, win 501, length 172
01:55:03.622252 IP 10.20.0.5.ssh > ip-45-74-123-101.user.start.ca.55341: Flags [P.], seq 1967016:1967188, ack 1045, win 501, length 172
01:55:03.622337 IP 10.20.0.5.ssh > ip-45-74-123-101.user.start.ca.55341: Flags [P.], seq 1967188:1967360, ack 1045, win 501, length 172
01:55:03.622427 IP 10.20.0.5.ssh > ip-45-74-123-101.user.start.ca.55341: Flags [P.], seq 1967360:1967532, ack 1045, win 501, length 172
01:55:03.622508 IP 10.20.0.5.ssh > ip-45-74-123-101.user.start.ca.55341: Flags [P.], seq 1967532:1967704, ack 1045, win 501, length 172
01:55:03.622614 IP 10.20.0.5.ssh > ip-45-74-123-101.user.start.ca.55341: Flags [P.], seq 1967704:1967876, ack 1045, win 501, length 172
01:55:03.622696 IP 10.20.0.5.ssh > ip-45-74-123-101.user.start.ca.55341: Flags [P.], seq 1967876:1968048, ack 1045, win 501, length 172
01:55:03.622776 IP 10.20.0.5.ssh > ip-45-74-123-101.user.start.ca.55341: Flags [P.], seq 1968048:1968220, ack 1045, win 501, length 172
01:55:03.622857 IP 10.20.0.5.ssh > ip-45-74-123-101.user.start.ca.55341: Flags [P.], seq 1968220:1968392, ack 1045, win 501, length 172
01:55:03.622938 IP 10.20.0.5.ssh > ip-45-74-123-101.user.start.ca.55341: Flags [P.], seq 1968392:1968564, ack 1045, win 501, length 172
01:55:03.623018 IP 10.20.0.5.ssh > ip-45-74-123-101.user.start.ca.55341: Flags [P.], seq 1968564:1968736, ack 1045, win 501, length 172
01:55:03.623104 IP 10.20.0.5.ssh > ip-45-74-123-101.user.start.ca.55341: Flags [P.], seq 1968736:1968908, ack 1045, win 501, length 172
01:55:03.623209 IP 10.20.0.5.ssh > ip-45-74-123-101.user.start.ca.55341: Flags [P.], seq 1968908:1969080, ack 1045, win 501, length 172
01:55:03.623316 IP 10.20.0.5.ssh > ip-45-74-123-101.user.start.ca.55341: Flags [P.], seq 1969080:1969252, ack 1045, win 501, length 172
01:55:03.623403 IP 10.20.0.5.ssh > ip-45-74-123-101.user.start.ca.55341: Flags [P.], seq 1969252:1969424, ack 1045, win 501, length 172
01:55:03.623490 IP 10.20.0.5.ssh > ip-45-74-123-101.user.start.ca.55341: Flags [P.], seq 1969424:1969596, ack 1045, win 501, length 172
01:55:03.623570 IP 10.20.0.5.ssh > ip-45-74-123-101.user.start.ca.55341: Flags [P.], seq 1969596:1969768, ack 1045, win 501, length 172
01:55:03.623656 IP 10.20.0.5.ssh > ip-45-74-123-101.user.start.ca.55341: Flags [P.], seq 1969768:1969940, ack 1045, win 501, length 172
01:55:03.623736 IP 10.20.0.5.ssh > ip-45-74-123-101.user.start.ca.55341: Flags [P.], seq 1969940:1970112, ack 1045, win 501, length 172
01:55:03.623821 IP 10.20.0.5.ssh > ip-45-74-123-101.user.start.ca.55341: Flags [P.], seq 1970112:1970284, ack 1045, win 501, length 172
01:55:03.623951 IP 10.20.0.5.ssh > ip-45-74-123-101.user.start.ca.55341: Flags [P.], seq 1970284:1970456, ack 1045, win 501, length 172
01:55:03.624064 IP 10.20.0.5.ssh > ip-45-74-123-101.user.start.ca.55341: Flags [P.], seq 1970456:1970628, ack 1045, win 501, length 172
01:55:03.624152 IP 10.20.0.5.ssh > ip-45-74-123-101.user.start.ca.55341: Flags [P.], seq 1970628:1970800, ack 1045, win 501, length 172
01:55:03.624239 IP 10.20.0.5.ssh > ip-45-74-123-101.user.start.ca.55341: Flags [P.], seq 1970800:1970972, ack 1045, win 501, length 172
01:55:03.624323 IP 10.20.0.5.ssh > ip-45-74-123-101.user.start.ca.55341: Flags [P.], seq 1970972:1971144, ack 1045, win 501, length 172
01:55:03.624406 IP 10.20.0.5.ssh > ip-45-74-123-101.user.start.ca.55341: Flags [P.], seq 1971144:1971316, ack 1045, win 501, length 172
01:55:03.624491 IP 10.20.0.5.ssh > ip-45-74-123-101.user.start.ca.55341: Flags [P.], seq 1971316:1971488, ack 1045, win 501, length 172
01:55:03.624573 IP 10.20.0.5.ssh > ip-45-74-123-101.user.start.ca.55341: Flags [P.], seq 1971488:1971660, ack 1045, win 501, length 172
01:55:03.624657 IP 10.20.0.5.ssh > ip-45-74-123-101.user.start.ca.55341: Flags [P.], seq 1971660:1971832, ack 1045, win 501, length 172
01:55:03.624738 IP 10.20.0.5.ssh > ip-45-74-123-101.user.start.ca.55341: Flags [P.], seq 1971832:1972004, ack 1045, win 501, length 172
01:55:03.624821 IP 10.20.0.5.ssh > ip-45-74-123-101.user.start.ca.55341: Flags [P.], seq 1972004:1972176, ack 1045, win 501, length 172
01:55:03.624905 IP 10.20.0.5.ssh > ip-45-74-123-101.user.start.ca.55341: Flags [P.], seq 1972176:1972348, ack 1045, win 501, length 172
01:55:03.624992 IP 10.20.0.5.ssh > ip-45-74-123-101.user.start.ca.55341: Flags [P.], seq 1972348:1972520, ack 1045, win 501, length 172
01:55:03.625074 IP 10.20.0.5.ssh > ip-45-74-123-101.user.start.ca.55341: Flags [P.], seq 1972520:1972692, ack 1045, win 501, length 172
01:55:03.625157 IP 10.20.0.5.ssh > ip-45-74-123-101.user.start.ca.55341: Flags [P.], seq 1972692:1972864, ack 1045, win 501, length 172
01:55:03.625238 IP 10.20.0.5.ssh > ip-45-74-123-101.user.start.ca.55341: Flags [P.], seq 1972864:1973036, ack 1045, win 501, length 172
01:55:03.625320 IP 10.20.0.5.ssh > ip-45-74-123-101.user.start.ca.55341: Flags [P.], seq 1973036:1973208, ack 1045, win 501, length 172
01:55:03.625400 IP 10.20.0.5.ssh > ip-45-74-123-101.user.start.ca.55341: Flags [P.], seq 1973208:1973380, ack 1045, win 501, length 172
01:55:03.625483 IP 10.20.0.5.ssh > ip-45-74-123-101.user.start.ca.55341: Flags [P.], seq 1973380:1973552, ack 1045, win 501, length 172
01:55:03.625564 IP 10.20.0.5.ssh > ip-45-74-123-101.user.start.ca.55341: Flags [P.], seq 1973552:1973724, ack 1045, win 501, length 172
01:55:03.625645 IP 10.20.0.5.ssh > ip-45-74-123-101.user.start.ca.55341: Flags [P.], seq 1973724:1973896, ack 1045, win 501, length 172
01:55:03.625729 IP 10.20.0.5.ssh > ip-45-74-123-101.user.start.ca.55341: Flags [P.], seq 1973896:1974068, ack 1045, win 501, length 172
01:55:03.625825 IP 10.20.0.5.ssh > ip-45-74-123-101.user.start.ca.55341: Flags [P.], seq 1974068:1974240, ack 1045, win 501, length 172
01:55:03.625945 IP 10.20.0.5.ssh > ip-45-74-123-101.user.start.ca.55341: Flags [P.], seq 1974240:1974412, ack 1045, win 501, length 172
01:55:03.626052 IP 10.20.0.5.ssh > ip-45-74-123-101.user.start.ca.55341: Flags [P.], seq 1974412:1974584, ack 1045, win 501, length 172
01:55:03.626141 IP 10.20.0.5.ssh > ip-45-74-123-101.user.start.ca.55341: Flags [P.], seq 1974584:1974756, ack 1045, win 501, length 172
01:55:03.626223 IP 10.20.0.5.ssh > ip-45-74-123-101.user.start.ca.55341: Flags [P.], seq 1974756:1974928, ack 1045, win 501, length 172
01:55:03.626312 IP 10.20.0.5.ssh > ip-45-74-123-101.user.start.ca.55341: Flags [P.], seq 1974928:1975100, ack 1045, win 501, length 172
01:55:03.626398 IP 10.20.0.5.ssh > ip-45-74-123-101.user.start.ca.55341: Flags [P.], seq 1975100:1975272, ack 1045, win 501, length 172
01:55:03.626479 IP 10.20.0.5.ssh > ip-45-74-123-101.user.start.ca.55341: Flags [P.], seq 1975272:1975444, ack 1045, win 501, length 172
01:55:03.626585 IP 10.20.0.5.ssh > ip-45-74-123-101.user.start.ca.55341: Flags [P.], seq 1975444:1975616, ack 1045, win 501, length 172
01:55:03.626667 IP 10.20.0.5.ssh > ip-45-74-123-101.user.start.ca.55341: Flags [P.], seq 1975616:1975788, ack 1045, win 501, length 172
01:55:03.626747 IP 10.20.0.5.ssh > ip-45-74-123-101.user.start.ca.55341: Flags [P.], seq 1975788:1975960, ack 1045, win 501, length 172
01:55:03.626829 IP 10.20.0.5.ssh > ip-45-74-123-101.user.start.ca.55341: Flags [P.], seq 1975960:1976132, ack 1045, win 501, length 172
01:55:03.626910 IP 10.20.0.5.ssh > ip-45-74-123-101.user.start.ca.55341: Flags [P.], seq 1976132:1976304, ack 1045, win 501, length 172
01:55:03.626994 IP 10.20.0.5.ssh > ip-45-74-123-101.user.start.ca.55341: Flags [P.], seq 1976304:1976476, ack 1045, win 501, length 172
01:55:03.627076 IP 10.20.0.5.ssh > ip-45-74-123-101.user.start.ca.55341: Flags [P.], seq 1976476:1976648, ack 1045, win 501, length 172
01:55:03.627114 IP ip-45-74-123-101.user.start.ca.55341 > 10.20.0.5.ssh: Flags [.], ack 1949464, win 509, length 0
01:55:03.627223 IP 10.20.0.5.ssh > ip-45-74-123-101.user.start.ca.55341: Flags [P.], seq 1976648:1976940, ack 1045, win 501, length 292
01:55:03.627314 IP 10.20.0.5.ssh > ip-45-74-123-101.user.start.ca.55341: Flags [P.], seq 1976940:1977112, ack 1045, win 501, length 172
01:55:03.627398 IP 10.20.0.5.ssh > ip-45-74-123-101.user.start.ca.55341: Flags [P.], seq 1977112:1977284, ack 1045, win 501, length 172
01:55:03.627523 IP 10.20.0.5.ssh > ip-45-74-123-101.user.start.ca.55341: Flags [P.], seq 1977284:1977456, ack 1045, win 501, length 172
01:55:03.627653 IP 10.20.0.5.ssh > ip-45-74-123-101.user.start.ca.55341: Flags [P.], seq 1977456:1977628, ack 1045, win 501, length 172
01:55:03.627750 IP 10.20.0.5.ssh > ip-45-74-123-101.user.start.ca.55341: Flags [P.], seq 1977628:1977800, ack 1045, win 501, length 172
01:55:03.627838 IP 10.20.0.5.ssh > ip-45-74-123-101.user.start.ca.55341: Flags [P.], seq 1977800:1977972, ack 1045, win 501, length 172
01:55:03.627920 IP 10.20.0.5.ssh > ip-45-74-123-101.user.start.ca.55341: Flags [P.], seq 1977972:1978144, ack 1045, win 501, length 172
01:55:03.628002 IP 10.20.0.5.ssh > ip-45-74-123-101.user.start.ca.55341: Flags [P.], seq 1978144:1978316, ack 1045, win 501, length 172
01:55:03.628087 IP 10.20.0.5.ssh > ip-45-74-123-101.user.start.ca.55341: Flags [P.], seq 1978316:1978488, ack 1045, win 501, length 172
01:55:03.628168 IP 10.20.0.5.ssh > ip-45-74-123-101.user.start.ca.55341: Flags [P.], seq 1978488:1978660, ack 1045, win 501, length 172
01:55:03.628254 IP 10.20.0.5.ssh > ip-45-74-123-101.user.start.ca.55341: Flags [P.], seq 1978660:1978832, ack 1045, win 501, length 172
01:55:03.628336 IP 10.20.0.5.ssh > ip-45-74-123-101.user.start.ca.55341: Flags [P.], seq 1978832:1979004, ack 1045, win 501, length 172
01:55:03.628416 IP 10.20.0.5.ssh > ip-45-74-123-101.user.start.ca.55341: Flags [P.], seq 1979004:1979176, ack 1045, win 501, length 172
01:55:03.628503 IP 10.20.0.5.ssh > ip-45-74-123-101.user.start.ca.55341: Flags [P.], seq 1979176:1979348, ack 1045, win 501, length 172
01:55:03.628588 IP 10.20.0.5.ssh > ip-45-74-123-101.user.start.ca.55341: Flags [P.], seq 1979348:1979520, ack 1045, win 501, length 172
01:55:03.628669 IP 10.20.0.5.ssh > ip-45-74-123-101.user.start.ca.55341: Flags [P.], seq 1979520:1979692, ack 1045, win 501, length 172
01:55:03.628756 IP 10.20.0.5.ssh > ip-45-74-123-101.user.start.ca.55341: Flags [P.], seq 1979692:1979864, ack 1045, win 501, length 172
01:55:03.628836 IP 10.20.0.5.ssh > ip-45-74-123-101.user.start.ca.55341: Flags [P.], seq 1979864:1980036, ack 1045, win 501, length 172
01:55:03.628917 IP 10.20.0.5.ssh > ip-45-74-123-101.user.start.ca.55341: Flags [P.], seq 1980036:1980208, ack 1045, win 501, length 172
01:55:03.629010 IP 10.20.0.5.ssh > ip-45-74-123-101.user.start.ca.55341: Flags [P.], seq 1980208:1980380, ack 1045, win 501, length 172
01:55:03.629093 IP 10.20.0.5.ssh > ip-45-74-123-101.user.start.ca.55341: Flags [P.], seq 1980380:1980552, ack 1045, win 501, length 172
01:55:03.629172 IP 10.20.0.5.ssh > ip-45-74-123-101.user.start.ca.55341: Flags [P.], seq 1980552:1980724, ack 1045, win 501, length 172
01:55:03.629254 IP 10.20.0.5.ssh > ip-45-74-123-101.user.start.ca.55341: Flags [P.], seq 1980724:1980896, ack 1045, win 501, length 172
01:55:03.629334 IP 10.20.0.5.ssh > ip-45-74-123-101.user.start.ca.55341: Flags [P.], seq 1980896:1981068, ack 1045, win 501, length 172
01:55:03.629414 IP 10.20.0.5.ssh > ip-45-74-123-101.user.start.ca.55341: Flags [P.], seq 1981068:1981240, ack 1045, win 501, length 172
01:55:03.629493 IP 10.20.0.5.ssh > ip-45-74-123-101.user.start.ca.55341: Flags [P.], seq 1981240:1981412, ack 1045, win 501, length 172
01:55:03.629572 IP 10.20.0.5.ssh > ip-45-74-123-101.user.start.ca.55341: Flags [P.], seq 1981412:1981584, ack 1045, win 501, length 172
01:55:03.629658 IP 10.20.0.5.ssh > ip-45-74-123-101.user.start.ca.55341: Flags [P.], seq 1981584:1981756, ack 1045, win 501, length 172
01:55:03.629737 IP 10.20.0.5.ssh > ip-45-74-123-101.user.start.ca.55341: Flags [P.], seq 1981756:1981928, ack 1045, win 501, length 172
01:55:03.629831 IP 10.20.0.5.ssh > ip-45-74-123-101.user.start.ca.55341: Flags [P.], seq 1981928:1982100, ack 1045, win 501, length 172
01:55:03.629918 IP 10.20.0.5.ssh > ip-45-74-123-101.user.start.ca.55341: Flags [P.], seq 1982100:1982272, ack 1045, win 501, length 172
01:55:03.630000 IP 10.20.0.5.ssh > ip-45-74-123-101.user.start.ca.55341: Flags [P.], seq 1982272:1982444, ack 1045, win 501, length 172
01:55:03.630085 IP 10.20.0.5.ssh > ip-45-74-123-101.user.start.ca.55341: Flags [P.], seq 1982444:1982616, ack 1045, win 501, length 172
01:55:03.630167 IP 10.20.0.5.ssh > ip-45-74-123-101.user.start.ca.55341: Flags [P.], seq 1982616:1982788, ack 1045, win 501, length 172
01:55:03.630247 IP 10.20.0.5.ssh > ip-45-74-123-101.user.start.ca.55341: Flags [P.], seq 1982788:1982960, ack 1045, win 501, length 172
01:55:03.630332 IP 10.20.0.5.ssh > ip-45-74-123-101.user.start.ca.55341: Flags [P.], seq 1982960:1983132, ack 1045, win 501, length 172
01:55:03.630457 IP 10.20.0.5.ssh > ip-45-74-123-101.user.start.ca.55341: Flags [P.], seq 1983132:1983304, ack 1045, win 501, length 172
01:55:03.630567 IP 10.20.0.5.ssh > ip-45-74-123-101.user.start.ca.55341: Flags [P.], seq 1983304:1983476, ack 1045, win 501, length 172
01:55:03.630649 IP 10.20.0.5.ssh > ip-45-74-123-101.user.start.ca.55341: Flags [P.], seq 1983476:1983648, ack 1045, win 501, length 172
01:55:03.630732 IP 10.20.0.5.ssh > ip-45-74-123-101.user.start.ca.55341: Flags [P.], seq 1983648:1983820, ack 1045, win 501, length 172
01:55:03.630817 IP 10.20.0.5.ssh > ip-45-74-123-101.user.start.ca.55341: Flags [P.], seq 1983820:1983992, ack 1045, win 501, length 172
01:55:03.630903 IP 10.20.0.5.ssh > ip-45-74-123-101.user.start.ca.55341: Flags [P.], seq 1983992:1984164, ack 1045, win 501, length 172
01:55:03.630985 IP 10.20.0.5.ssh > ip-45-74-123-101.user.start.ca.55341: Flags [P.], seq 1984164:1984336, ack 1045, win 501, length 172
01:55:03.631070 IP 10.20.0.5.ssh > ip-45-74-123-101.user.start.ca.55341: Flags [P.], seq 1984336:1984508, ack 1045, win 501, length 172
01:55:03.631150 IP 10.20.0.5.ssh > ip-45-74-123-101.user.start.ca.55341: Flags [P.], seq 1984508:1984680, ack 1045, win 501, length 172
01:55:03.631236 IP 10.20.0.5.ssh > ip-45-74-123-101.user.start.ca.55341: Flags [P.], seq 1984680:1984852, ack 1045, win 501, length 172
01:55:03.631316 IP 10.20.0.5.ssh > ip-45-74-123-101.user.start.ca.55341: Flags [P.], seq 1984852:1985024, ack 1045, win 501, length 172
01:55:03.631431 IP 10.20.0.5.ssh > ip-45-74-123-101.user.start.ca.55341: Flags [P.], seq 1985024:1985196, ack 1045, win 501, length 172
01:55:03.631532 IP 10.20.0.5.ssh > ip-45-74-123-101.user.start.ca.55341: Flags [P.], seq 1985196:1985368, ack 1045, win 501, length 172
01:55:03.631619 IP 10.20.0.5.ssh > ip-45-74-123-101.user.start.ca.55341: Flags [P.], seq 1985368:1985540, ack 1045, win 501, length 172
01:55:03.631706 IP 10.20.0.5.ssh > ip-45-74-123-101.user.start.ca.55341: Flags [P.], seq 1985540:1985712, ack 1045, win 501, length 172
01:55:03.631788 IP 10.20.0.5.ssh > ip-45-74-123-101.user.start.ca.55341: Flags [P.], seq 1985712:1985884, ack 1045, win 501, length 172
01:55:03.631871 IP 10.20.0.5.ssh > ip-45-74-123-101.user.start.ca.55341: Flags [P.], seq 1985884:1986056, ack 1045, win 501, length 172
01:55:03.631956 IP 10.20.0.5.ssh > ip-45-74-123-101.user.start.ca.55341: Flags [P.], seq 1986056:1986228, ack 1045, win 501, length 172
01:55:03.632037 IP 10.20.0.5.ssh > ip-45-74-123-101.user.start.ca.55341: Flags [P.], seq 1986228:1986400, ack 1045, win 501, length 172
01:55:03.632129 IP 10.20.0.5.ssh > ip-45-74-123-101.user.start.ca.55341: Flags [P.], seq 1986400:1986572, ack 1045, win 501, length 172
01:55:03.632278 IP 10.20.0.5.ssh > ip-45-74-123-101.user.start.ca.55341: Flags [P.], seq 1986572:1986744, ack 1045, win 501, length 172
01:55:03.632409 IP 10.20.0.5.ssh > ip-45-74-123-101.user.start.ca.55341: Flags [P.], seq 1986744:1986916, ack 1045, win 501, length 172
01:55:03.632519 IP 10.20.0.5.ssh > ip-45-74-123-101.user.start.ca.55341: Flags [P.], seq 1986916:1987088, ack 1045, win 501, length 172
01:55:03.632605 IP 10.20.0.5.ssh > ip-45-74-123-101.user.start.ca.55341: Flags [P.], seq 1987088:1987260, ack 1045, win 501, length 172
01:55:03.632693 IP 10.20.0.5.ssh > ip-45-74-123-101.user.start.ca.55341: Flags [P.], seq 1987260:1987432, ack 1045, win 501, length 172
01:55:03.632782 IP 10.20.0.5.ssh > ip-45-74-123-101.user.start.ca.55341: Flags [P.], seq 1987432:1987604, ack 1045, win 501, length 172
01:55:03.632868 IP 10.20.0.5.ssh > ip-45-74-123-101.user.start.ca.55341: Flags [P.], seq 1987604:1987776, ack 1045, win 501, length 172
01:55:03.632949 IP 10.20.0.5.ssh > ip-45-74-123-101.user.start.ca.55341: Flags [P.], seq 1987776:1987948, ack 1045, win 501, length 172
01:55:03.633039 IP 10.20.0.5.ssh > ip-45-74-123-101.user.start.ca.55341: Flags [P.], seq 1987948:1988120, ack 1045, win 501, length 172
01:55:03.633166 IP 10.20.0.5.ssh > ip-45-74-123-101.user.start.ca.55341: Flags [P.], seq 1988120:1988292, ack 1045, win 501, length 172
01:55:03.633254 IP 10.20.0.5.ssh > ip-45-74-123-101.user.start.ca.55341: Flags [P.], seq 1988292:1988464, ack 1045, win 501, length 172
01:55:03.633412 IP 10.20.0.5.ssh > ip-45-74-123-101.user.start.ca.55341: Flags [P.], seq 1988464:1988636, ack 1045, win 501, length 172
01:55:03.633533 IP 10.20.0.5.ssh > ip-45-74-123-101.user.start.ca.55341: Flags [P.], seq 1988636:1988808, ack 1045, win 501, length 172
01:55:03.633650 IP 10.20.0.5.ssh > ip-45-74-123-101.user.start.ca.55341: Flags [P.], seq 1988808:1988980, ack 1045, win 501, length 172
01:55:03.633763 IP 10.20.0.5.ssh > ip-45-74-123-101.user.start.ca.55341: Flags [P.], seq 1988980:1989152, ack 1045, win 501, length 172
01:55:03.633801 IP ip-45-74-123-101.user.start.ca.55341 > 10.20.0.5.ssh: Flags [.], ack 1952904, win 510, length 0
01:55:03.633818 IP ip-45-74-123-101.user.start.ca.55341 > 10.20.0.5.ssh: Flags [.], ack 1956920, win 513, length 0
01:55:03.633996 IP 10.20.0.5.ssh > ip-45-74-123-101.user.start.ca.55341: Flags [P.], seq 1989152:1989556, ack 1045, win 501, length 404
01:55:03.634117 IP 10.20.0.5.ssh > ip-45-74-123-101.user.start.ca.55341: Flags [P.], seq 1989556:1989728, ack 1045, win 501, length 172
01:55:03.634234 IP 10.20.0.5.ssh > ip-45-74-123-101.user.start.ca.55341: Flags [P.], seq 1989728:1989900, ack 1045, win 501, length 172
01:55:03.634343 IP 10.20.0.5.ssh > ip-45-74-123-101.user.start.ca.55341: Flags [P.], seq 1989900:1990072, ack 1045, win 501, length 172
01:55:03.634449 IP 10.20.0.5.ssh > ip-45-74-123-101.user.start.ca.55341: Flags [P.], seq 1990072:1990244, ack 1045, win 501, length 172
01:55:03.634582 IP 10.20.0.5.ssh > ip-45-74-123-101.user.start.ca.55341: Flags [P.], seq 1990244:1990416, ack 1045, win 501, length 172
01:55:03.634703 IP 10.20.0.5.ssh > ip-45-74-123-101.user.start.ca.55341: Flags [P.], seq 1990416:1990588, ack 1045, win 501, length 172
01:55:03.634812 IP 10.20.0.5.ssh > ip-45-74-123-101.user.start.ca.55341: Flags [P.], seq 1990588:1990760, ack 1045, win 501, length 172
01:55:03.634913 IP 10.20.0.5.ssh > ip-45-74-123-101.user.start.ca.55341: Flags [P.], seq 1990760:1990932, ack 1045, win 501, length 172
01:55:03.635024 IP 10.20.0.5.ssh > ip-45-74-123-101.user.start.ca.55341: Flags [P.], seq 1990932:1991104, ack 1045, win 501, length 172
01:55:03.635126 IP 10.20.0.5.ssh > ip-45-74-123-101.user.start.ca.55341: Flags [P.], seq 1991104:1991276, ack 1045, win 501, length 172
01:55:03.635231 IP 10.20.0.5.ssh > ip-45-74-123-101.user.start.ca.55341: Flags [P.], seq 1991276:1991448, ack 1045, win 501, length 172
01:55:03.635342 IP 10.20.0.5.ssh > ip-45-74-123-101.user.start.ca.55341: Flags [P.], seq 1991448:1991620, ack 1045, win 501, length 172
01:55:03.635429 IP 10.20.0.5.ssh > ip-45-74-123-101.user.start.ca.55341: Flags [P.], seq 1991620:1991792, ack 1045, win 501, length 172
01:55:03.635510 IP 10.20.0.5.ssh > ip-45-74-123-101.user.start.ca.55341: Flags [P.], seq 1991792:1991964, ack 1045, win 501, length 172
01:55:03.635593 IP 10.20.0.5.ssh > ip-45-74-123-101.user.start.ca.55341: Flags [P.], seq 1991964:1992136, ack 1045, win 501, length 172
01:55:03.635691 IP 10.20.0.5.ssh > ip-45-74-123-101.user.start.ca.55341: Flags [P.], seq 1992136:1992308, ack 1045, win 501, length 172
01:55:03.635783 IP 10.20.0.5.ssh > ip-45-74-123-101.user.start.ca.55341: Flags [P.], seq 1992308:1992480, ack 1045, win 501, length 172
01:55:03.635867 IP 10.20.0.5.ssh > ip-45-74-123-101.user.start.ca.55341: Flags [P.], seq 1992480:1992652, ack 1045, win 501, length 172
01:55:03.635948 IP 10.20.0.5.ssh > ip-45-74-123-101.user.start.ca.55341: Flags [P.], seq 1992652:1992824, ack 1045, win 501, length 172
01:55:03.636065 IP 10.20.0.5.ssh > ip-45-74-123-101.user.start.ca.55341: Flags [P.], seq 1992824:1992996, ack 1045, win 501, length 172
01:55:03.636163 IP 10.20.0.5.ssh > ip-45-74-123-101.user.start.ca.55341: Flags [P.], seq 1992996:1993168, ack 1045, win 501, length 172
01:55:03.636247 IP 10.20.0.5.ssh > ip-45-74-123-101.user.start.ca.55341: Flags [P.], seq 1993168:1993340, ack 1045, win 501, length 172
01:55:03.636328 IP 10.20.0.5.ssh > ip-45-74-123-101.user.start.ca.55341: Flags [P.], seq 1993340:1993512, ack 1045, win 501, length 172
01:55:03.636408 IP 10.20.0.5.ssh > ip-45-74-123-101.user.start.ca.55341: Flags [P.], seq 1993512:1993684, ack 1045, win 501, length 172
01:55:03.636489 IP 10.20.0.5.ssh > ip-45-74-123-101.user.start.ca.55341: Flags [P.], seq 1993684:1993856, ack 1045, win 501, length 172
01:55:03.636575 IP 10.20.0.5.ssh > ip-45-74-123-101.user.start.ca.55341: Flags [P.], seq 1993856:1994028, ack 1045, win 501, length 172
01:55:03.636658 IP 10.20.0.5.ssh > ip-45-74-123-101.user.start.ca.55341: Flags [P.], seq 1994028:1994200, ack 1045, win 501, length 172
01:55:03.636739 IP 10.20.0.5.ssh > ip-45-74-123-101.user.start.ca.55341: Flags [P.], seq 1994200:1994372, ack 1045, win 501, length 172
01:55:03.636824 IP 10.20.0.5.ssh > ip-45-74-123-101.user.start.ca.55341: Flags [P.], seq 1994372:1994544, ack 1045, win 501, length 172
01:55:03.636904 IP 10.20.0.5.ssh > ip-45-74-123-101.user.start.ca.55341: Flags [P.], seq 1994544:1994716, ack 1045, win 501, length 172
01:55:03.636984 IP 10.20.0.5.ssh > ip-45-74-123-101.user.start.ca.55341: Flags [P.], seq 1994716:1994888, ack 1045, win 501, length 172
01:55:03.637066 IP 10.20.0.5.ssh > ip-45-74-123-101.user.start.ca.55341: Flags [P.], seq 1994888:1995060, ack 1045, win 501, length 172
01:55:03.637151 IP 10.20.0.5.ssh > ip-45-74-123-101.user.start.ca.55341: Flags [P.], seq 1995060:1995232, ack 1045, win 501, length 172
01:55:03.637233 IP 10.20.0.5.ssh > ip-45-74-123-101.user.start.ca.55341: Flags [P.], seq 1995232:1995404, ack 1045, win 501, length 172
01:55:03.637316 IP 10.20.0.5.ssh > ip-45-74-123-101.user.start.ca.55341: Flags [P.], seq 1995404:1995576, ack 1045, win 501, length 172
01:55:03.637396 IP 10.20.0.5.ssh > ip-45-74-123-101.user.start.ca.55341: Flags [P.], seq 1995576:1995748, ack 1045, win 501, length 172
01:55:03.637481 IP 10.20.0.5.ssh > ip-45-74-123-101.user.start.ca.55341: Flags [P.], seq 1995748:1995920, ack 1045, win 501, length 172
01:55:03.637561 IP 10.20.0.5.ssh > ip-45-74-123-101.user.start.ca.55341: Flags [P.], seq 1995920:1996092, ack 1045, win 501, length 172
01:55:03.637644 IP 10.20.0.5.ssh > ip-45-74-123-101.user.start.ca.55341: Flags [P.], seq 1996092:1996264, ack 1045, win 501, length 172
01:55:03.637710 IP ip-45-74-123-101.user.start.ca.55341 > 10.20.0.5.ssh: Flags [P.], seq 1045:1081, ack 1952904, win 510, length 36
01:55:03.637804 IP 10.20.0.5.ssh > ip-45-74-123-101.user.start.ca.55341: Flags [P.], seq 1996264:1996572, ack 1081, win 501, length 308
01:55:03.637892 IP 10.20.0.5.ssh > ip-45-74-123-101.user.start.ca.55341: Flags [P.], seq 1996572:1996744, ack 1081, win 501, length 172
01:55:03.637972 IP 10.20.0.5.ssh > ip-45-74-123-101.user.start.ca.55341: Flags [P.], seq 1996744:1996916, ack 1081, win 501, length 172
01:55:03.638054 IP 10.20.0.5.ssh > ip-45-74-123-101.user.start.ca.55341: Flags [P.], seq 1996916:1997088, ack 1081, win 501, length 172
01:55:03.638147 IP 10.20.0.5.ssh > ip-45-74-123-101.user.start.ca.55341: Flags [P.], seq 1997088:1997260, ack 1081, win 501, length 172
01:55:03.638229 IP 10.20.0.5.ssh > ip-45-74-123-101.user.start.ca.55341: Flags [P.], seq 1997260:1997432, ack 1081, win 501, length 172
01:55:03.638310 IP 10.20.0.5.ssh > ip-45-74-123-101.user.start.ca.55341: Flags [P.], seq 1997432:1997604, ack 1081, win 501, length 172
01:55:03.638397 IP 10.20.0.5.ssh > ip-45-74-123-101.user.start.ca.55341: Flags [P.], seq 1997604:1997776, ack 1081, win 501, length 172
01:55:03.638476 IP 10.20.0.5.ssh > ip-45-74-123-101.user.start.ca.55341: Flags [P.], seq 1997776:1997948, ack 1081, win 501, length 172
01:55:03.638579 IP 10.20.0.5.ssh > ip-45-74-123-101.user.start.ca.55341: Flags [P.], seq 1997948:1998120, ack 1081, win 501, length 172
01:55:03.638665 IP 10.20.0.5.ssh > ip-45-74-123-101.user.start.ca.55341: Flags [P.], seq 1998120:1998292, ack 1081, win 501, length 172
01:55:03.638749 IP 10.20.0.5.ssh > ip-45-74-123-101.user.start.ca.55341: Flags [P.], seq 1998292:1998464, ack 1081, win 501, length 172
01:55:03.638842 IP 10.20.0.5.ssh > ip-45-74-123-101.user.start.ca.55341: Flags [P.], seq 1998464:1998636, ack 1081, win 501, length 172
01:55:03.638925 IP 10.20.0.5.ssh > ip-45-74-123-101.user.start.ca.55341: Flags [P.], seq 1998636:1998808, ack 1081, win 501, length 172
01:55:03.639005 IP 10.20.0.5.ssh > ip-45-74-123-101.user.start.ca.55341: Flags [P.], seq 1998808:1998980, ack 1081, win 501, length 172
01:55:03.639085 IP 10.20.0.5.ssh > ip-45-74-123-101.user.start.ca.55341: Flags [P.], seq 1998980:1999152, ack 1081, win 501, length 172
01:55:03.639174 IP 10.20.0.5.ssh > ip-45-74-123-101.user.start.ca.55341: Flags [P.], seq 1999152:1999324, ack 1081, win 501, length 172
01:55:03.639266 IP 10.20.0.5.ssh > ip-45-74-123-101.user.start.ca.55341: Flags [P.], seq 1999324:1999496, ack 1081, win 501, length 172
01:55:03.639347 IP 10.20.0.5.ssh > ip-45-74-123-101.user.start.ca.55341: Flags [P.], seq 1999496:1999668, ack 1081, win 501, length 172
01:55:03.639429 IP 10.20.0.5.ssh > ip-45-74-123-101.user.start.ca.55341: Flags [P.], seq 1999668:1999840, ack 1081, win 501, length 172
01:55:03.639514 IP 10.20.0.5.ssh > ip-45-74-123-101.user.start.ca.55341: Flags [P.], seq 1999840:2000012, ack 1081, win 501, length 172
01:55:03.639595 IP 10.20.0.5.ssh > ip-45-74-123-101.user.start.ca.55341: Flags [P.], seq 2000012:2000184, ack 1081, win 501, length 172
01:55:03.639674 IP 10.20.0.5.ssh > ip-45-74-123-101.user.start.ca.55341: Flags [P.], seq 2000184:2000356, ack 1081, win 501, length 172
01:55:03.639752 IP 10.20.0.5.ssh > ip-45-74-123-101.user.start.ca.55341: Flags [P.], seq 2000356:2000528, ack 1081, win 501, length 172
01:55:03.639833 IP 10.20.0.5.ssh > ip-45-74-123-101.user.start.ca.55341: Flags [P.], seq 2000528:2000700, ack 1081, win 501, length 172
01:55:03.639911 IP 10.20.0.5.ssh > ip-45-74-123-101.user.start.ca.55341: Flags [P.], seq 2000700:2000872, ack 1081, win 501, length 172
01:55:03.639989 IP 10.20.0.5.ssh > ip-45-74-123-101.user.start.ca.55341: Flags [P.], seq 2000872:2001044, ack 1081, win 501, length 172
01:55:03.640071 IP 10.20.0.5.ssh > ip-45-74-123-101.user.start.ca.55341: Flags [P.], seq 2001044:2001216, ack 1081, win 501, length 172
01:55:03.640158 IP 10.20.0.5.ssh > ip-45-74-123-101.user.start.ca.55341: Flags [P.], seq 2001216:2001388, ack 1081, win 501, length 172
01:55:03.640243 IP 10.20.0.5.ssh > ip-45-74-123-101.user.start.ca.55341: Flags [P.], seq 2001388:2001560, ack 1081, win 501, length 172
01:55:03.640327 IP 10.20.0.5.ssh > ip-45-74-123-101.user.start.ca.55341: Flags [P.], seq 2001560:2001732, ack 1081, win 501, length 172
01:55:03.640406 IP 10.20.0.5.ssh > ip-45-74-123-101.user.start.ca.55341: Flags [P.], seq 2001732:2001904, ack 1081, win 501, length 172
01:55:03.640486 IP 10.20.0.5.ssh > ip-45-74-123-101.user.start.ca.55341: Flags [P.], seq 2001904:2002076, ack 1081, win 501, length 172
01:55:03.640567 IP 10.20.0.5.ssh > ip-45-74-123-101.user.start.ca.55341: Flags [P.], seq 2002076:2002248, ack 1081, win 501, length 172
01:55:03.640648 IP 10.20.0.5.ssh > ip-45-74-123-101.user.start.ca.55341: Flags [P.], seq 2002248:2002420, ack 1081, win 501, length 172
01:55:03.640733 IP 10.20.0.5.ssh > ip-45-74-123-101.user.start.ca.55341: Flags [P.], seq 2002420:2002592, ack 1081, win 501, length 172
01:55:03.640818 IP 10.20.0.5.ssh > ip-45-74-123-101.user.start.ca.55341: Flags [P.], seq 2002592:2002764, ack 1081, win 501, length 172
01:55:03.640900 IP 10.20.0.5.ssh > ip-45-74-123-101.user.start.ca.55341: Flags [P.], seq 2002764:2002936, ack 1081, win 501, length 172
01:55:03.640985 IP 10.20.0.5.ssh > ip-45-74-123-101.user.start.ca.55341: Flags [P.], seq 2002936:2003108, ack 1081, win 501, length 172
01:55:03.641088 IP 10.20.0.5.ssh > ip-45-74-123-101.user.start.ca.55341: Flags [P.], seq 2003108:2003280, ack 1081, win 501, length 172
01:55:03.641224 IP 10.20.0.5.ssh > ip-45-74-123-101.user.start.ca.55341: Flags [P.], seq 2003280:2003452, ack 1081, win 501, length 172
01:55:03.641360 IP 10.20.0.5.ssh > ip-45-74-123-101.user.start.ca.55341: Flags [P.], seq 2003452:2003624, ack 1081, win 501, length 172
01:55:03.641448 IP 10.20.0.5.ssh > ip-45-74-123-101.user.start.ca.55341: Flags [P.], seq 2003624:2003796, ack 1081, win 501, length 172
01:55:03.641529 IP 10.20.0.5.ssh > ip-45-74-123-101.user.start.ca.55341: Flags [P.], seq 2003796:2003968, ack 1081, win 501, length 172
01:55:03.641563 IP ip-45-74-123-101.user.start.ca.55341 > 10.20.0.5.ssh: Flags [.], ack 1966552, win 508, length 0
01:55:03.641757 IP 10.20.0.5.ssh > ip-45-74-123-101.user.start.ca.55341: Flags [P.], seq 2003968:2004260, ack 1081, win 501, length 292
01:55:03.641870 IP 10.20.0.5.ssh > ip-45-74-123-101.user.start.ca.55341: Flags [P.], seq 2004260:2004432, ack 1081, win 501, length 172
01:55:03.641956 IP 10.20.0.5.ssh > ip-45-74-123-101.user.start.ca.55341: Flags [P.], seq 2004432:2004604, ack 1081, win 501, length 172
01:55:03.642037 IP 10.20.0.5.ssh > ip-45-74-123-101.user.start.ca.55341: Flags [P.], seq 2004604:2004776, ack 1081, win 501, length 172
01:55:03.642119 IP 10.20.0.5.ssh > ip-45-74-123-101.user.start.ca.55341: Flags [P.], seq 2004776:2004948, ack 1081, win 501, length 172
01:55:03.642199 IP 10.20.0.5.ssh > ip-45-74-123-101.user.start.ca.55341: Flags [P.], seq 2004948:2005120, ack 1081, win 501, length 172
01:55:03.642291 IP 10.20.0.5.ssh > ip-45-74-123-101.user.start.ca.55341: Flags [P.], seq 2005120:2005292, ack 1081, win 501, length 172
01:55:03.642412 IP 10.20.0.5.ssh > ip-45-74-123-101.user.start.ca.55341: Flags [P.], seq 2005292:2005464, ack 1081, win 501, length 172
01:55:03.642507 IP 10.20.0.5.ssh > ip-45-74-123-101.user.start.ca.55341: Flags [P.], seq 2005464:2005636, ack 1081, win 501, length 172
01:55:03.642607 IP 10.20.0.5.ssh > ip-45-74-123-101.user.start.ca.55341: Flags [P.], seq 2005636:2005808, ack 1081, win 501, length 172
01:55:03.642695 IP 10.20.0.5.ssh > ip-45-74-123-101.user.start.ca.55341: Flags [P.], seq 2005808:2005980, ack 1081, win 501, length 172
01:55:03.642778 IP 10.20.0.5.ssh > ip-45-74-123-101.user.start.ca.55341: Flags [P.], seq 2005980:2006152, ack 1081, win 501, length 172
01:55:03.642863 IP 10.20.0.5.ssh > ip-45-74-123-101.user.start.ca.55341: Flags [P.], seq 2006152:2006324, ack 1081, win 501, length 172
01:55:03.642945 IP 10.20.0.5.ssh > ip-45-74-123-101.user.start.ca.55341: Flags [P.], seq 2006324:2006496, ack 1081, win 501, length 172
01:55:03.643026 IP 10.20.0.5.ssh > ip-45-74-123-101.user.start.ca.55341: Flags [P.], seq 2006496:2006668, ack 1081, win 501, length 172
01:55:03.643112 IP 10.20.0.5.ssh > ip-45-74-123-101.user.start.ca.55341: Flags [P.], seq 2006668:2006840, ack 1081, win 501, length 172
01:55:03.643193 IP 10.20.0.5.ssh > ip-45-74-123-101.user.start.ca.55341: Flags [P.], seq 2006840:2007012, ack 1081, win 501, length 172
01:55:03.643235 IP ip-45-74-123-101.user.start.ca.55341 > 10.20.0.5.ssh: Flags [.], ack 1979864, win 507, length 0
01:55:03.643370 IP 10.20.0.5.ssh > ip-45-74-123-101.user.start.ca.55341: Flags [P.], seq 2007012:2007304, ack 1081, win 501, length 292
01:55:03.643461 IP 10.20.0.5.ssh > ip-45-74-123-101.user.start.ca.55341: Flags [P.], seq 2007304:2007476, ack 1081, win 501, length 172
01:55:03.643546 IP 10.20.0.5.ssh > ip-45-74-123-101.user.start.ca.55341: Flags [P.], seq 2007476:2007648, ack 1081, win 501, length 172
01:55:03.643631 IP 10.20.0.5.ssh > ip-45-74-123-101.user.start.ca.55341: Flags [P.], seq 2007648:2007820, ack 1081, win 501, length 172
01:55:03.643718 IP 10.20.0.5.ssh > ip-45-74-123-101.user.start.ca.55341: Flags [P.], seq 2007820:2007992, ack 1081, win 501, length 172
01:55:03.643800 IP 10.20.0.5.ssh > ip-45-74-123-101.user.start.ca.55341: Flags [P.], seq 2007992:2008164, ack 1081, win 501, length 172
01:55:03.643883 IP 10.20.0.5.ssh > ip-45-74-123-101.user.start.ca.55341: Flags [P.], seq 2008164:2008336, ack 1081, win 501, length 172
01:55:03.643965 IP 10.20.0.5.ssh > ip-45-74-123-101.user.start.ca.55341: Flags [P.], seq 2008336:2008508, ack 1081, win 501, length 172
01:55:03.644051 IP 10.20.0.5.ssh > ip-45-74-123-101.user.start.ca.55341: Flags [P.], seq 2008508:2008680, ack 1081, win 501, length 172
01:55:03.644131 IP 10.20.0.5.ssh > ip-45-74-123-101.user.start.ca.55341: Flags [P.], seq 2008680:2008852, ack 1081, win 501, length 172
01:55:03.644213 IP 10.20.0.5.ssh > ip-45-74-123-101.user.start.ca.55341: Flags [P.], seq 2008852:2009024, ack 1081, win 501, length 172
01:55:03.644298 IP 10.20.0.5.ssh > ip-45-74-123-101.user.start.ca.55341: Flags [P.], seq 2009024:2009196, ack 1081, win 501, length 172
01:55:03.644378 IP 10.20.0.5.ssh > ip-45-74-123-101.user.start.ca.55341: Flags [P.], seq 2009196:2009368, ack 1081, win 501, length 172
01:55:03.644463 IP 10.20.0.5.ssh > ip-45-74-123-101.user.start.ca.55341: Flags [P.], seq 2009368:2009540, ack 1081, win 501, length 172
01:55:03.644542 IP 10.20.0.5.ssh > ip-45-74-123-101.user.start.ca.55341: Flags [P.], seq 2009540:2009712, ack 1081, win 501, length 172
01:55:03.644622 IP 10.20.0.5.ssh > ip-45-74-123-101.user.start.ca.55341: Flags [P.], seq 2009712:2009884, ack 1081, win 501, length 172