root@lamp-ubuntu-s-1vcpu-1gb-tor1-01:~# root@lamp-ubuntu-s-1vcpu-1gb-tor1-01:~# tcpdump -r 0001.pcap
reading from file 0001.pcap, link-type EN10MB (Ethernet)
05:25:55.261654 IP 10.20.0.5.ssh > ip-45-74-123-101.user.start.ca.65237: Flags [P.], seq 3500143159:3500143203, ack 1245861297, win 501, length 44
05:25:55.261833 IP 10.20.0.5.ssh > ip-45-74-123-101.user.start.ca.65237: Flags [P.], seq 44:152, ack 1, win 501, length 108
05:25:55.261931 IP 10.20.0.5.ssh > ip-45-74-123-101.user.start.ca.65237: Flags [P.], seq 152:188, ack 1, win 501, length 36
05:25:55.279260 IP ip-45-74-123-101.user.start.ca.65237 > 10.20.0.5.ssh: Flags [.], ack 188, win 9943, length 0
05:25:55.502630 IP 118.24.211.170.58804 > 10.20.0.5.ssh: Flags [S], seq 3666475003, win 29200, options [mss 1424,sackOK,TS val 3316063374 ecr 0,nop,wscale 7], length 0
05:25:55.502714 IP 10.20.0.5 > 118.24.211.170: ICMP 10.20.0.5 tcp port ssh unreachable, length 68
05:25:56.406625 IP 159.89.112.251.ssh > 40.90.202.114.60589: Flags [S.], seq 1778977741, ack 2154149274, win 64240, options [mss 1460], length 0
05:25:56.502821 IP 167.71.226.154.58598 > 10.20.0.5.ssh: Flags [S], seq 4250812175, win 29200, options [mss 1460,sackOK,TS val 1870310283 ecr 0,nop,wscale 7], length 0
05:25:56.502908 IP 10.20.0.5 > 167.71.226.154: ICMP 10.20.0.5 tcp port ssh unreachable, length 68
05:25:56.503349 IP 118.24.211.170.58804 > 10.20.0.5.ssh: Flags [S], seq 3666475003, win 29200, options [mss 1424,sackOK,TS val 3316064376 ecr 0,nop,wscale 7], length 0
05:25:56.503383 IP 10.20.0.5 > 118.24.211.170: ICMP 10.20.0.5 tcp port ssh unreachable, length 68
05:25:57.174665 IP 10.20.0.5.ssh > 59.83.222.82.40452: Flags [P.], seq 3074226049:3074226117, ack 1660334839, win 507, options [nop,nop,TS val 3117585935 ecr 793276461], length 68
05:25:57.508204 IP 59.83.222.82.40452 > 10.20.0.5.ssh: Flags [.], ack 68, win 154, options [nop,nop,TS val 793286903 ecr 3117585935,nop,nop,sack 1 {0:68}], length 0
05:25:57.508273 IP 10.20.0.5 > 59.83.222.82: ICMP 10.20.0.5 tcp port ssh unreachable, length 72
05:25:57.532941 IP 167.71.226.154.58598 > 10.20.0.5.ssh: Flags [S], seq 4250812175, win 29200, options [mss 1460,sackOK,TS val 1870311314 ecr 0,nop,wscale 7], length 0
05:25:57.533041 IP 10.20.0.5 > 167.71.226.154: ICMP 10.20.0.5 tcp port ssh unreachable, length 68
05:25:57.660717 IP 59.83.222.82.40452 > 10.20.0.5.ssh: Flags [P.], seq 1:53, ack 68, win 154, options [nop,nop,TS val 793287056 ecr 3117585935], length 52
05:25:57.660784 IP 10.20.0.5 > 59.83.222.82: ICMP 10.20.0.5 tcp port ssh unreachable, length 112
05:25:58.507419 IP 118.24.211.170.58804 > 10.20.0.5.ssh: Flags [S], seq 3666475003, win 29200, options [mss 1424,sackOK,TS val 3316066380 ecr 0,nop,wscale 7], length 0
05:25:58.507508 IP 10.20.0.5 > 118.24.211.170: ICMP 10.20.0.5 tcp port ssh unreachable, length 68
05:25:58.585699 IP 122.228.19.79.6237 > 159.89.112.251.snmp-trap:  GetNextRequest(22)
05:25:59.370911 IP security.criminalip.com.53168 > 159.89.112.251.3098: Flags [S], seq 731974742, win 65535, length 0
05:25:59.548783 IP 167.71.226.154.58598 > 10.20.0.5.ssh: Flags [S], seq 4250812175, win 29200, options [mss 1460,sackOK,TS val 1870313330 ecr 0,nop,wscale 7], length 0
05:25:59.548857 IP 10.20.0.5 > 167.71.226.154: ICMP 10.20.0.5 tcp port ssh unreachable, length 68
05:26:00.937656 IP 123.161.211.7.64407 > 159.89.112.251.ms-sql-s: Flags [S], seq 3504962514, win 8192, options [mss 1380,nop,wscale 8,nop,nop,sackOK], length 0
05:26:02.319227 IP 218.92.0.195.47627 > 10.20.0.5.ssh: Flags [S], seq 108435432, win 29200, options [mss 1460,sackOK,TS val 385374064 ecr 0,nop,wscale 7], length 0
05:26:02.319319 IP 10.20.0.5.ssh > 218.92.0.195.47627: Flags [S.], seq 1072250893, ack 108435433, win 65160, options [mss 1460,sackOK,TS val 739656398 ecr 385374064,nop,wscale 7], length 0
05:26:02.511376 IP 118.24.211.170.58804 > 10.20.0.5.ssh: Flags [S], seq 3666475003, win 29200, options [mss 1424,sackOK,TS val 3316070384 ecr 0,nop,wscale 7], length 0
05:26:02.511447 IP 10.20.0.5 > 118.24.211.170: ICMP 10.20.0.5 tcp port ssh unreachable, length 68
05:26:03.317747 IP 218.92.0.195.47627 > 10.20.0.5.ssh: Flags [S], seq 108435432, win 29200, options [mss 1460,sackOK,TS val 385374314 ecr 0,nop,wscale 7], length 0
05:26:03.317824 IP 10.20.0.5.ssh > 218.92.0.195.47627: Flags [S.], seq 1072250893, ack 108435433, win 65160, options [mss 1460,sackOK,TS val 739657397 ecr 385374064,nop,wscale 7], length 0
05:26:03.318607 IP 10.20.0.5.ssh > 59.83.222.82.40452: Flags [P.], seq 0:68, ack 1, win 507, options [nop,nop,TS val 3117592079 ecr 793276461], length 68
05:26:03.638069 IP 59.83.222.82.40452 > 10.20.0.5.ssh: Flags [.], ack 68, win 154, options [nop,nop,TS val 793293033 ecr 3117592079,nop,nop,sack 1 {0:68}], length 0
05:26:03.638138 IP 10.20.0.5 > 59.83.222.82: ICMP 10.20.0.5 tcp port ssh unreachable, length 72
05:26:03.676997 IP 167.71.226.154.58598 > 10.20.0.5.ssh: Flags [S], seq 4250812175, win 29200, options [mss 1460,sackOK,TS val 1870317458 ecr 0,nop,wscale 7], length 0
05:26:03.677084 IP 10.20.0.5 > 167.71.226.154: ICMP 10.20.0.5 tcp port ssh unreachable, length 68
05:26:03.683904 IP 81.161.63.251.53130 > 159.89.112.251.ssh: Flags [S], seq 3991533986, win 29200, options [mss 1460,sackOK,TS val 143646406 ecr 0,nop,wscale 9], length 0
05:26:03.683980 IP 159.89.112.251.ssh > 81.161.63.251.53130: Flags [S.], seq 4216769769, ack 3991533987, win 65160, options [mss 1460,sackOK,TS val 3034885046 ecr 143646406,nop,wscale 7], length 0
05:26:03.816959 IP 81.161.63.251.53130 > 159.89.112.251.ssh: Flags [.], ack 1, win 58, options [nop,nop,TS val 143646439 ecr 3034885046], length 0
05:26:03.840381 IP 159.89.112.251.ssh > 81.161.63.251.53130: Flags [P.], seq 1:42, ack 1, win 510, options [nop,nop,TS val 3034885202 ecr 143646439], length 41
05:26:03.943538 IP 123.161.211.7.64407 > 159.89.112.251.ms-sql-s: Flags [S], seq 3504962514, win 8192, options [mss 1380,nop,wscale 8,nop,nop,sackOK], length 0
05:26:03.972873 IP 81.161.63.251.53130 > 159.89.112.251.ssh: Flags [.], ack 42, win 58, options [nop,nop,TS val 143646478 ecr 3034885202], length 0
05:26:04.342641 IP 10.20.0.5.ssh > 218.92.0.195.47627: Flags [S.], seq 1072250893, ack 108435433, win 65160, options [mss 1460,sackOK,TS val 739658422 ecr 385374064,nop,wscale 7], length 0
05:26:04.412925 IP 81.161.63.251.20942 > 159.89.112.251.ssh: Flags [S], seq 1232877013, win 29200, options [mss 1460,sackOK,TS val 143646589 ecr 0,nop,wscale 9], length 0
05:26:04.413029 IP 159.89.112.251.ssh > 81.161.63.251.20942: Flags [S.], seq 3023641804, ack 1232877014, win 65160, options [mss 1460,sackOK,TS val 3034885775 ecr 143646589,nop,wscale 7], length 0
05:26:04.413435 IP 81.161.63.251.21056 > 159.89.112.251.ssh: Flags [S], seq 2414339546, win 29200, options [mss 1460,sackOK,TS val 143646589 ecr 0,nop,wscale 9], length 0
05:26:04.413470 IP 159.89.112.251.ssh > 81.161.63.251.21056: Flags [S.], seq 1901279737, ack 2414339547, win 65160, options [mss 1460,sackOK,TS val 3034885776 ecr 143646589,nop,wscale 7], length 0
05:26:04.413836 IP 81.161.63.251.53130 > 159.89.112.251.ssh: Flags [R.], seq 1, ack 42, win 58, options [nop,nop,TS val 143646589 ecr 3034885202], length 0
05:26:04.420538 IP 81.161.63.251.21048 > 159.89.112.251.ssh: Flags [S], seq 1624556758, win 29200, options [mss 1460,sackOK,TS val 143646589 ecr 0,nop,wscale 9], length 0
05:26:04.420594 IP 159.89.112.251.ssh > 81.161.63.251.21048: Flags [S.], seq 3272527135, ack 1624556759, win 65160, options [mss 1460,sackOK,TS val 3034885783 ecr 143646589,nop,wscale 7], length 0
05:26:04.536016 IP 81.161.63.251.21056 > 159.89.112.251.ssh: Flags [.], ack 1, win 58, options [nop,nop,TS val 143646619 ecr 3034885776], length 0
05:26:04.536418 IP 81.161.63.251.20942 > 159.89.112.251.ssh: Flags [.], ack 1, win 58, options [nop,nop,TS val 143646620 ecr 3034885775], length 0
05:26:04.549679 IP 81.161.63.251.21048 > 159.89.112.251.ssh: Flags [.], ack 1, win 58, options [nop,nop,TS val 143646621 ecr 3034885783], length 0
05:26:04.593384 IP 159.89.112.251.ssh > 81.161.63.251.21056: Flags [P.], seq 1:42, ack 1, win 510, options [nop,nop,TS val 3034885955 ecr 143646619], length 41
05:26:04.595980 IP 159.89.112.251.ssh > 81.161.63.251.20942: Flags [P.], seq 1:42, ack 1, win 510, options [nop,nop,TS val 3034885958 ecr 143646620], length 41
05:26:04.604562 IP 159.89.112.251.ssh > 81.161.63.251.21048: Flags [P.], seq 1:42, ack 1, win 510, options [nop,nop,TS val 3034885967 ecr 143646621], length 41
05:26:04.719463 IP 81.161.63.251.20942 > 159.89.112.251.ssh: Flags [.], ack 42, win 58, options [nop,nop,TS val 143646665 ecr 3034885958], length 0
05:26:04.733721 IP 81.161.63.251.21048 > 159.89.112.251.ssh: Flags [.], ack 42, win 58, options [nop,nop,TS val 143646667 ecr 3034885967], length 0
05:26:04.982644 IP 159.89.112.251.ssh > 81.161.63.251.21056: Flags [P.], seq 1:42, ack 1, win 510, options [nop,nop,TS val 3034886345 ecr 143646619], length 41
05:26:05.325747 IP 218.92.0.195.47627 > 10.20.0.5.ssh: Flags [S], seq 108435432, win 29200, options [mss 1460,sackOK,TS val 385374816 ecr 0,nop,wscale 7], length 0
05:26:05.325836 IP 10.20.0.5.ssh > 218.92.0.195.47627: Flags [S.], seq 1072250893, ack 108435433, win 65160, options [mss 1460,sackOK,TS val 739659405 ecr 385374064,nop,wscale 7], length 0
05:26:05.366632 IP 159.89.112.251.ssh > 81.161.63.251.21056: Flags [P.], seq 1:42, ack 1, win 510, options [nop,nop,TS val 3034886729 ecr 143646619], length 41
05:26:05.489339 IP 81.161.63.251.21056 > 159.89.112.251.ssh: Flags [.], ack 42, win 58, options [nop,nop,TS val 143646858 ecr 3034886729,nop,nop,sack 1 {1:42}], length 0
05:26:05.563444 IP 218.92.0.195.47627 > 10.20.0.5.ssh: Flags [.], ack 1, win 229, options [nop,nop,TS val 385374875 ecr 739659405], length 0
05:26:05.563555 IP 218.92.0.195.47627 > 10.20.0.5.ssh: Flags [P.], seq 1:16, ack 1, win 229, options [nop,nop,TS val 385374875 ecr 739659405], length 15
05:26:05.587817 IP 10.20.0.5.ssh > 218.92.0.195.47627: Flags [P.], seq 1:42, ack 1, win 510, options [nop,nop,TS val 739659667 ecr 385374875], length 41
05:26:05.666810 IP 81.161.63.251.20942 > 159.89.112.251.ssh: Flags [P.], seq 13:925, ack 42, win 58, options [nop,nop,TS val 143646902 ecr 3034885958], length 912
05:26:05.666879 IP 159.89.112.251.ssh > 81.161.63.251.20942: Flags [.], ack 1, win 510, options [nop,nop,TS val 3034887029 ecr 143646665,nop,nop,sack 1 {13:925}], length 0
05:26:05.677640 IP 81.161.63.251.21056 > 159.89.112.251.ssh: Flags [P.], seq 13:925, ack 42, win 58, options [nop,nop,TS val 143646905 ecr 3034886729], length 912
05:26:05.677682 IP 159.89.112.251.ssh > 81.161.63.251.21056: Flags [.], ack 1, win 510, options [nop,nop,TS val 3034887040 ecr 143646858,nop,nop,sack 1 {13:925}], length 0
05:26:05.710621 IP 81.161.63.251.21048 > 159.89.112.251.ssh: Flags [P.], seq 1:13, ack 42, win 58, options [nop,nop,TS val 143646911 ecr 3034885967], length 12
05:26:05.710706 IP 159.89.112.251.ssh > 81.161.63.251.21048: Flags [.], ack 13, win 510, options [nop,nop,TS val 3034887073 ecr 143646911], length 0
05:26:05.713358 IP 159.89.112.251.ssh > 81.161.63.251.21048: Flags [P.], seq 42:1098, ack 13, win 510, options [nop,nop,TS val 3034887075 ecr 143646911], length 1056
05:26:05.716322 IP 81.161.63.251.21048 > 159.89.112.251.ssh: Flags [P.], seq 13:925, ack 42, win 58, options [nop,nop,TS val 143646912 ecr 3034885967], length 912
05:26:05.716385 IP 159.89.112.251.ssh > 81.161.63.251.21048: Flags [.], ack 925, win 503, options [nop,nop,TS val 3034887078 ecr 143646912], length 0
05:26:05.823980 IP 81.161.63.251.20942 > 159.89.112.251.ssh: Flags [P.], seq 1:13, ack 42, win 58, options [nop,nop,TS val 143646942 ecr 3034887029], length 12
05:26:05.824091 IP 159.89.112.251.ssh > 81.161.63.251.20942: Flags [.], ack 925, win 503, options [nop,nop,TS val 3034887186 ecr 143646942], length 0
05:26:05.825310 IP 218.92.0.195.47627 > 10.20.0.5.ssh: Flags [.], ack 42, win 229, options [nop,nop,TS val 385374940 ecr 739659667], length 0
05:26:05.827272 IP 159.89.112.251.ssh > 81.161.63.251.20942: Flags [P.], seq 42:1098, ack 925, win 503, options [nop,nop,TS val 3034887189 ecr 143646942], length 1056
05:26:05.950780 IP 81.161.63.251.20942 > 159.89.112.251.ssh: Flags [.], ack 1098, win 62, options [nop,nop,TS val 143646973 ecr 3034887189], length 0
05:26:06.102645 IP 159.89.112.251.ssh > 81.161.63.251.21048: Flags [P.], seq 42:1098, ack 925, win 503, options [nop,nop,TS val 3034887465 ecr 143646912], length 1056
05:26:06.231882 IP 81.161.63.251.21048 > 159.89.112.251.ssh: Flags [.], ack 1098, win 62, options [nop,nop,TS val 143647042 ecr 3034887465,nop,nop,sack 1 {42:1098}], length 0
05:26:06.877552 IP 118.24.211.170.60312 > 10.20.0.5.ssh: Flags [FP.], seq 2984626113:2984626165, ack 1474630383, win 262, options [nop,nop,TS val 3316074752 ecr 3591561077], length 52
05:26:06.877652 IP 10.20.0.5 > 118.24.211.170: ICMP 10.20.0.5 tcp port ssh unreachable, length 112
05:26:08.078841 IP 81.161.63.251.21048 > 159.89.112.251.ssh: Flags [P.], seq 925:973, ack 1098, win 62, options [nop,nop,TS val 143647504 ecr 3034887465], length 48
05:26:08.078937 IP 159.89.112.251.ssh > 81.161.63.251.21048: Flags [.], ack 973, win 503, options [nop,nop,TS val 3034889441 ecr 143647504], length 0
05:26:08.090102 IP 159.89.112.251.ssh > 81.161.63.251.21048: Flags [P.], seq 1098:1378, ack 973, win 503, options [nop,nop,TS val 3034889452 ecr 143647504], length 280
05:26:08.219268 IP 81.161.63.251.21048 > 159.89.112.251.ssh: Flags [.], ack 1378, win 66, options [nop,nop,TS val 143647539 ecr 3034889452], length 0
05:26:09.000625 IP 81.161.63.251.21056 > 159.89.112.251.ssh: Flags [P.], seq 1:13, ack 42, win 58, options [nop,nop,TS val 143647736 ecr 3034887040], length 12
05:26:09.000708 IP 159.89.112.251.ssh > 81.161.63.251.21056: Flags [.], ack 925, win 503, options [nop,nop,TS val 3034890363 ecr 143647736], length 0
05:26:09.003599 IP 159.89.112.251.ssh > 81.161.63.251.21056: Flags [P.], seq 42:1098, ack 925, win 503, options [nop,nop,TS val 3034890366 ecr 143647736], length 1056
05:26:09.026731 IP 59.83.222.82.40452 > 10.20.0.5.ssh: Flags [P.], seq 1:53, ack 68, win 154, options [nop,nop,TS val 793298422 ecr 3117592079], length 52
05:26:09.026835 IP 10.20.0.5 > 59.83.222.82: ICMP 10.20.0.5 tcp port ssh unreachable, length 112
05:26:09.154788 IP 81.161.63.251.21048 > 159.89.112.251.ssh: Flags [P.], seq 973:989, ack 1378, win 66, options [nop,nop,TS val 143647773 ecr 3034889452], length 16
05:26:09.154863 IP 159.89.112.251.ssh > 81.161.63.251.21048: Flags [.], ack 989, win 503, options [nop,nop,TS val 3034890517 ecr 143647773], length 0
05:26:09.256124 IP 81.161.63.251.20942 > 159.89.112.251.ssh: Flags [P.], seq 925:973, ack 1098, win 62, options [nop,nop,TS val 143647800 ecr 3034887189], length 48
05:26:09.256217 IP 159.89.112.251.ssh > 81.161.63.251.20942: Flags [.], ack 973, win 503, options [nop,nop,TS val 3034890618 ecr 143647800], length 0
05:26:09.267585 IP 159.89.112.251.ssh > 81.161.63.251.20942: Flags [P.], seq 1098:1378, ack 973, win 503, options [nop,nop,TS val 3034890630 ecr 143647800], length 280
05:26:09.283980 IP 81.161.63.251.21048 > 159.89.112.251.ssh: Flags [P.], seq 989:1041, ack 1378, win 66, options [nop,nop,TS val 143647805 ecr 3034890517], length 52
05:26:09.284046 IP 159.89.112.251.ssh > 81.161.63.251.21048: Flags [.], ack 1041, win 503, options [nop,nop,TS val 3034890646 ecr 143647805], length 0
05:26:09.284199 IP 159.89.112.251.ssh > 81.161.63.251.21048: Flags [P.], seq 1378:1430, ack 1041, win 503, options [nop,nop,TS val 3034890646 ecr 143647805], length 52
05:26:09.398662 IP 159.89.112.251.ssh > 81.161.63.251.21056: Flags [P.], seq 42:1098, ack 925, win 503, options [nop,nop,TS val 3034890761 ecr 143647736], length 1056
05:26:09.413301 IP 81.161.63.251.21048 > 159.89.112.251.ssh: Flags [.], ack 1430, win 66, options [nop,nop,TS val 143647837 ecr 3034890646], length 0
05:26:09.447739 IP hn.kd.ny.adsl.59598 > 10.20.0.5.telnet: Flags [S], seq 2649113664, win 24480, length 0
05:26:09.521275 IP 81.161.63.251.21056 > 159.89.112.251.ssh: Flags [.], ack 1098, win 62, options [nop,nop,TS val 143647866 ecr 3034890761,nop,nop,sack 1 {42:1098}], length 0
05:26:09.574059 IP 81.161.63.251.21048 > 159.89.112.251.ssh: Flags [P.], seq 1041:1109, ack 1430, win 66, options [nop,nop,TS val 143647877 ecr 3034890646], length 68
05:26:09.580049 IP 81.161.63.251.20942 > 159.89.112.251.ssh: Flags [P.], seq 973:989, ack 1378, win 66, options [nop,nop,TS val 143647881 ecr 3034890630], length 16
05:26:09.580108 IP 159.89.112.251.ssh > 81.161.63.251.20942: Flags [.], ack 989, win 503, options [nop,nop,TS val 3034890942 ecr 143647881], length 0
05:26:09.580136 IP 81.161.63.251.20942 > 159.89.112.251.ssh: Flags [P.], seq 989:1041, ack 1378, win 66, options [nop,nop,TS val 143647881 ecr 3034890630], length 52
05:26:09.580147 IP 159.89.112.251.ssh > 81.161.63.251.20942: Flags [.], ack 1041, win 503, options [nop,nop,TS val 3034890942 ecr 143647881], length 0
05:26:09.586750 IP 159.89.112.251.ssh > 81.161.63.251.20942: Flags [P.], seq 1378:1430, ack 1041, win 503, options [nop,nop,TS val 3034890949 ecr 143647881], length 52
05:26:09.588321 IP 159.89.112.251.ssh > 81.161.63.251.21048: Flags [P.], seq 1430:1482, ack 1109, win 503, options [nop,nop,TS val 3034890950 ecr 143647877], length 52
05:26:09.710139 IP 81.161.63.251.20942 > 159.89.112.251.ssh: Flags [.], ack 1430, win 66, options [nop,nop,TS val 143647913 ecr 3034890949], length 0
05:26:09.763127 IP 81.161.63.251.20942 > 159.89.112.251.ssh: Flags [P.], seq 1041:1109, ack 1430, win 66, options [nop,nop,TS val 143647926 ecr 3034890949], length 68
05:26:09.768102 IP 81.161.63.251.21056 > 159.89.112.251.ssh: Flags [P.], seq 925:973, ack 1098, win 62, options [nop,nop,TS val 143647928 ecr 3034890761], length 48
05:26:09.768166 IP 159.89.112.251.ssh > 81.161.63.251.21056: Flags [.], ack 973, win 503, options [nop,nop,TS val 3034891130 ecr 143647928], length 0
05:26:09.769532 IP 81.161.63.251.21048 > 159.89.112.251.ssh: Flags [P.], seq 1109:1193, ack 1482, win 66, options [nop,nop,TS val 143647926 ecr 3034890950], length 84
05:26:09.782239 IP 159.89.112.251.ssh > 81.161.63.251.20942: Flags [P.], seq 1430:1482, ack 1109, win 503, options [nop,nop,TS val 3034891144 ecr 143647926], length 52
05:26:09.791019 IP 159.89.112.251.ssh > 81.161.63.251.21056: Flags [P.], seq 1098:1378, ack 973, win 503, options [nop,nop,TS val 3034891153 ecr 143647928], length 280
05:26:09.810641 IP 159.89.112.251.ssh > 81.161.63.251.21048: Flags [.], ack 1193, win 503, options [nop,nop,TS val 3034891173 ecr 143647926], length 0
05:26:09.905742 IP 81.161.63.251.20942 > 159.89.112.251.ssh: Flags [.], ack 1482, win 66, options [nop,nop,TS val 143647962 ecr 3034891144], length 0
05:26:09.913525 IP 81.161.63.251.21056 > 159.89.112.251.ssh: Flags [.], ack 1378, win 66, options [nop,nop,TS val 143647964 ecr 3034891153], length 0
05:26:10.172413 ARP, Request who-has 159.89.112.251 tell 159.89.112.1, length 46
05:26:10.172439 ARP, Reply 159.89.112.251 is-at b2:80:93:76:81:60 (oui Unknown), length 28
05:26:10.280038 IP 81.161.63.251.20942 > 159.89.112.251.ssh: Flags [P.], seq 1109:1193, ack 1482, win 66, options [nop,nop,TS val 143648056 ecr 3034891144], length 84
05:26:10.288088 IP 81.161.63.251.21056 > 159.89.112.251.ssh: Flags [P.], seq 973:989, ack 1378, win 66, options [nop,nop,TS val 143648058 ecr 3034891153], length 16
05:26:10.288145 IP 159.89.112.251.ssh > 81.161.63.251.21056: Flags [.], ack 989, win 503, options [nop,nop,TS val 3034891650 ecr 143648058], length 0
05:26:10.322640 IP 159.89.112.251.ssh > 81.161.63.251.20942: Flags [.], ack 1193, win 503, options [nop,nop,TS val 3034891685 ecr 143648056], length 0
05:26:10.410678 IP 81.161.63.251.21056 > 159.89.112.251.ssh: Flags [P.], seq 989:1041, ack 1378, win 66, options [nop,nop,TS val 143648088 ecr 3034891650], length 52
05:26:10.410743 IP 159.89.112.251.ssh > 81.161.63.251.21056: Flags [.], ack 1041, win 503, options [nop,nop,TS val 3034891773 ecr 143648088], length 0
05:26:10.410944 IP 159.89.112.251.ssh > 81.161.63.251.21056: Flags [P.], seq 1378:1430, ack 1041, win 503, options [nop,nop,TS val 3034891773 ecr 143648088], length 52
05:26:10.533790 IP 81.161.63.251.21056 > 159.89.112.251.ssh: Flags [P.], seq 1041:1109, ack 1430, win 66, options [nop,nop,TS val 143648119 ecr 3034891773], length 68
05:26:10.541301 IP 159.89.112.251.ssh > 81.161.63.251.21056: Flags [P.], seq 1430:1482, ack 1109, win 503, options [nop,nop,TS val 3034891903 ecr 143648119], length 52
05:26:10.561055 IP 119.61.19.84.40556 > 159.89.112.251.ssh: Flags [S], seq 863259532, win 29200, options [mss 1460,sackOK,TS val 64660320 ecr 0,nop,wscale 8], length 0
05:26:10.561139 IP 159.89.112.251.ssh > 119.61.19.84.40556: Flags [S.], seq 3367157565, ack 863259533, win 65160, options [mss 1460,sackOK,TS val 719018685 ecr 64660320,nop,wscale 7], length 0
05:26:10.792288 IP 119.61.19.84.40556 > 159.89.112.251.ssh: Flags [.], ack 1, win 115, options [nop,nop,TS val 64660378 ecr 719018685], length 0
05:26:10.814755 IP 159.89.112.251.ssh > 119.61.19.84.40556: Flags [P.], seq 1:42, ack 1, win 510, options [nop,nop,TS val 719018939 ecr 64660378], length 41
05:26:10.830757 IP 218.92.0.195.47627 > 10.20.0.5.ssh: Flags [FP.], seq 16:896, ack 42, win 229, options [nop,nop,TS val 385376192 ecr 739659667], length 880
05:26:10.902655 IP 159.89.112.251.ssh > 81.161.63.251.21056: Flags [P.], seq 1430:1482, ack 1109, win 503, options [nop,nop,TS val 3034892265 ecr 143648119], length 52
05:26:11.025234 IP 81.161.63.251.21056 > 159.89.112.251.ssh: Flags [.], ack 1482, win 66, options [nop,nop,TS val 143648242 ecr 3034892265,nop,nop,sack 1 {1430:1482}], length 0
05:26:11.045424 IP 119.61.19.84.40556 > 159.89.112.251.ssh: Flags [.], ack 42, win 115, options [nop,nop,TS val 64660441 ecr 719018939], length 0
05:26:11.045512 IP 119.61.19.84.40556 > 159.89.112.251.ssh: Flags [P.], seq 1:22, ack 42, win 115, options [nop,nop,TS val 64660441 ecr 719018939], length 21
05:26:11.045540 IP 159.89.112.251.ssh > 119.61.19.84.40556: Flags [.], ack 22, win 510, options [nop,nop,TS val 719019170 ecr 64660441], length 0
05:26:11.048350 IP 159.89.112.251.ssh > 119.61.19.84.40556: Flags [P.], seq 42:1098, ack 22, win 510, options [nop,nop,TS val 719019172 ecr 64660441], length 1056
05:26:11.279329 IP 119.61.19.84.40556 > 159.89.112.251.ssh: Flags [P.], seq 22:462, ack 1098, win 123, options [nop,nop,TS val 64660499 ecr 719019172], length 440
05:26:11.279453 IP 159.89.112.251.ssh > 119.61.19.84.40556: Flags [.], ack 462, win 507, options [nop,nop,TS val 719019404 ecr 64660499], length 0
05:26:11.376133 IP 81.161.63.251.21056 > 159.89.112.251.ssh: Flags [P.], seq 1109:1193, ack 1482, win 66, options [nop,nop,TS val 143648330 ecr 3034892265], length 84
05:26:11.418656 IP 159.89.112.251.ssh > 81.161.63.251.21056: Flags [.], ack 1193, win 503, options [nop,nop,TS val 3034892781 ecr 143648330], length 0
05:26:11.510180 IP 119.61.19.84.40556 > 159.89.112.251.ssh: Flags [P.], seq 462:510, ack 1098, win 123, options [nop,nop,TS val 64660557 ecr 719019404], length 48
05:26:11.510261 IP 159.89.112.251.ssh > 119.61.19.84.40556: Flags [.], ack 510, win 507, options [nop,nop,TS val 719019634 ecr 64660557], length 0
05:26:11.521185 IP 159.89.112.251.ssh > 119.61.19.84.40556: Flags [P.], seq 1098:1378, ack 510, win 507, options [nop,nop,TS val 719019645 ecr 64660557], length 280
05:26:11.754808 IP 119.61.19.84.40556 > 159.89.112.251.ssh: Flags [P.], seq 510:526, ack 1378, win 131, options [nop,nop,TS val 64660618 ecr 719019645], length 16
05:26:11.754897 IP 159.89.112.251.ssh > 119.61.19.84.40556: Flags [.], ack 526, win 507, options [nop,nop,TS val 719019879 ecr 64660618], length 0
05:26:11.985808 IP 119.61.19.84.40556 > 159.89.112.251.ssh: Flags [P.], seq 526:578, ack 1378, win 131, options [nop,nop,TS val 64660676 ecr 719019879], length 52
05:26:11.985864 IP 159.89.112.251.ssh > 119.61.19.84.40556: Flags [.], ack 578, win 507, options [nop,nop,TS val 719020110 ecr 64660676], length 0
05:26:11.986077 IP 159.89.112.251.ssh > 119.61.19.84.40556: Flags [P.], seq 1378:1430, ack 578, win 507, options [nop,nop,TS val 719020110 ecr 64660676], length 52
05:26:12.219637 IP 119.61.19.84.40556 > 159.89.112.251.ssh: Flags [P.], seq 578:662, ack 1430, win 131, options [nop,nop,TS val 64660734 ecr 719020110], length 84
05:26:12.262655 IP 159.89.112.251.ssh > 119.61.19.84.40556: Flags [.], ack 662, win 507, options [nop,nop,TS val 719020387 ecr 64660734], length 0
05:26:12.534672 IP 159.89.112.251.ssh > 40.90.202.114.60589: Flags [S.], seq 1778977741, ack 2154149274, win 64240, options [mss 1460], length 0
05:26:12.578866 IP 159.89.112.251.ssh > 81.161.63.251.20942: Flags [P.], seq 1482:1534, ack 1193, win 503, options [nop,nop,TS val 3034893941 ecr 143648056], length 52
05:26:12.702385 IP 81.161.63.251.20942 > 159.89.112.251.ssh: Flags [F.], seq 1193, ack 1534, win 66, options [nop,nop,TS val 143648661 ecr 3034893941], length 0
05:26:12.707719 IP 159.89.112.251.ssh > 81.161.63.251.20942: Flags [F.], seq 1534, ack 1194, win 503, options [nop,nop,TS val 3034894070 ecr 143648661], length 0
05:26:12.739943 IP 119.61.19.84.40556 > 159.89.112.251.ssh: Flags [P.], seq 578:662, ack 1430, win 131, options [nop,nop,TS val 64660865 ecr 719020110], length 84
05:26:12.739998 IP 159.89.112.251.ssh > 119.61.19.84.40556: Flags [.], ack 662, win 507, options [nop,nop,TS val 719020864 ecr 64660865,nop,nop,sack 1 {578:662}], length 0
05:26:12.831210 IP 81.161.63.251.20942 > 159.89.112.251.ssh: Flags [.], ack 1535, win 66, options [nop,nop,TS val 143648693 ecr 3034894070], length 0
05:26:13.331276 IP 159.89.112.251.ssh > 81.161.63.251.21048: Flags [P.], seq 1482:1534, ack 1193, win 503, options [nop,nop,TS val 3034894693 ecr 143647926], length 52
05:26:13.460441 IP 81.161.63.251.21048 > 159.89.112.251.ssh: Flags [.], ack 1534, win 66, options [nop,nop,TS val 143648849 ecr 3034894693], length 0
05:26:13.460492 IP 81.161.63.251.21048 > 159.89.112.251.ssh: Flags [F.], seq 1193, ack 1534, win 66, options [nop,nop,TS val 143648849 ecr 3034894693], length 0
05:26:13.465647 IP 159.89.112.251.ssh > 81.161.63.251.21048: Flags [F.], seq 1534, ack 1194, win 503, options [nop,nop,TS val 3034894828 ecr 143648849], length 0
05:26:13.594808 IP 81.161.63.251.21048 > 159.89.112.251.ssh: Flags [.], ack 1535, win 66, options [nop,nop,TS val 143648883 ecr 3034894828], length 0
05:26:15.034415 IP 159.89.112.251.ssh > 81.161.63.251.21056: Flags [P.], seq 1482:1534, ack 1193, win 503, options [nop,nop,TS val 3034896397 ecr 143648330], length 52
05:26:15.309873 IP 218.92.0.195.47627 > 10.20.0.5.ssh: Flags [FP.], seq 16:896, ack 42, win 229, options [nop,nop,TS val 385377312 ecr 739659667], length 880
05:26:15.309958 IP 10.20.0.5.ssh > 218.92.0.195.47627: Flags [.], ack 1, win 510, options [nop,nop,TS val 739669389 ecr 385374875,nop,nop,sack 1 {16:897}], length 0
05:26:15.382647 IP 159.89.112.251.ssh > 81.161.63.251.21056: Flags [P.], seq 1482:1534, ack 1193, win 503, options [nop,nop,TS val 3034896745 ecr 143648330], length 52
05:26:15.505314 IP 81.161.63.251.21056 > 159.89.112.251.ssh: Flags [.], ack 1534, win 66, options [nop,nop,TS val 143649362 ecr 3034896745,nop,nop,sack 1 {1482:1534}], length 0
05:26:15.505397 IP 159.89.112.251 > 81.161.63.251: ICMP 159.89.112.251 tcp port ssh unreachable, length 72
05:26:15.606662 IP 10.20.0.5.ssh > 59.83.222.82.40452: Flags [P.], seq 0:68, ack 1, win 507, options [nop,nop,TS val 3117604367 ecr 793276461], length 68
05:26:15.734685 IP 159.89.112.251.ssh > 81.161.63.251.21056: Flags [P.], seq 1482:1534, ack 1193, win 503, options [nop,nop,TS val 3034897097 ecr 143648330], length 52
05:26:15.857259 IP 81.161.63.251.21056 > 159.89.112.251.ssh: Flags [.], ack 1534, win 66, options [nop,nop,TS val 143649450 ecr 3034897097,nop,nop,sack 1 {1482:1534}], length 0
05:26:15.857362 IP 159.89.112.251 > 81.161.63.251: ICMP 159.89.112.251 tcp port ssh unreachable, length 72
05:26:15.939080 IP 59.83.222.82.40452 > 10.20.0.5.ssh: Flags [.], ack 68, win 154, options [nop,nop,TS val 793305334 ecr 3117604367,nop,nop,sack 1 {0:68}], length 0
05:26:15.939159 IP 10.20.0.5 > 59.83.222.82: ICMP 10.20.0.5 tcp port ssh unreachable, length 72
05:26:16.264952 IP 81.161.63.251.21056 > 159.89.112.251.ssh: Flags [F.], seq 1193, ack 1534, win 66, options [nop,nop,TS val 143649552 ecr 3034897097], length 0
05:26:16.265055 IP 159.89.112.251 > 81.161.63.251: ICMP 159.89.112.251 tcp port ssh unreachable, length 60
05:26:16.361674 IP 218.92.0.195.47627 > 10.20.0.5.ssh: Flags [P.], seq 1:16, ack 42, win 229, options [nop,nop,TS val 385377575 ecr 739669389], length 15
05:26:16.361765 IP 10.20.0.5.ssh > 218.92.0.195.47627: Flags [.], ack 897, win 503, options [nop,nop,TS val 739670441 ecr 385377575], length 0
05:26:16.364673 IP 10.20.0.5.ssh > 218.92.0.195.47627: Flags [P.], seq 42:1098, ack 897, win 503, options [nop,nop,TS val 739670444 ecr 385377575], length 1056
05:26:16.370240 IP 10.20.0.5.ssh > 218.92.0.195.47627: Flags [F.], seq 1098, ack 897, win 503, options [nop,nop,TS val 739670449 ecr 385377575], length 0
05:26:16.438658 IP 159.89.112.251.ssh > 81.161.63.251.21056: Flags [P.], seq 1482:1534, ack 1193, win 503, options [nop,nop,TS val 3034897801 ecr 143648330], length 52
05:26:16.561238 IP 81.161.63.251.21056 > 159.89.112.251.ssh: Flags [.], ack 1534, win 66, options [nop,nop,TS val 143649626 ecr 3034897801,nop,nop,sack 1 {1482:1534}], length 0
05:26:16.561333 IP 159.89.112.251 > 81.161.63.251: ICMP 159.89.112.251 tcp port ssh unreachable, length 72
05:26:16.602087 IP 218.92.0.195.47627 > 10.20.0.5.ssh: Flags [R], seq 108436329, win 0, length 0
05:26:16.607815 IP 218.92.0.195.47627 > 10.20.0.5.ssh: Flags [R], seq 108436329, win 0, length 0
05:26:16.616103 IP 81.161.63.251.21056 > 159.89.112.251.ssh: Flags [F.], seq 1193, ack 1534, win 66, options [nop,nop,TS val 143649640 ecr 3034897801], length 0
05:26:16.616159 IP 159.89.112.251 > 81.161.63.251: ICMP 159.89.112.251 tcp port ssh unreachable, length 60
05:26:16.801054 IP 159.89.112.251.ssh > 119.61.19.84.40556: Flags [P.], seq 1430:1498, ack 662, win 507, options [nop,nop,TS val 719024925 ecr 64660865], length 68
05:26:16.969194 IP 81.161.63.251.21056 > 159.89.112.251.ssh: Flags [F.], seq 1193, ack 1534, win 66, options [nop,nop,TS val 143649728 ecr 3034897801], length 0
05:26:16.969298 IP 159.89.112.251 > 81.161.63.251: ICMP 159.89.112.251 tcp port ssh unreachable, length 60
05:26:17.031963 IP 119.61.19.84.40556 > 159.89.112.251.ssh: Flags [P.], seq 662:714, ack 1498, win 131, options [nop,nop,TS val 64661937 ecr 719024925], length 52
05:26:17.032034 IP 159.89.112.251.ssh > 119.61.19.84.40556: Flags [.], ack 714, win 507, options [nop,nop,TS val 719025156 ecr 64661937], length 0
05:26:17.032087 IP 119.61.19.84.40556 > 159.89.112.251.ssh: Flags [F.], seq 714, ack 1498, win 131, options [nop,nop,TS val 64661937 ecr 719024925], length 0
05:26:17.036343 IP 159.89.112.251.ssh > 119.61.19.84.40556: Flags [F.], seq 1498, ack 715, win 507, options [nop,nop,TS val 719025160 ecr 64661937], length 0
05:26:17.273054 IP 194.147.140.101.54917 > 10.20.0.5.7212: Flags [S], seq 1408616445, win 1024, length 0
05:26:17.398686 IP 10.20.0.5.ssh > 148.ip-92-222-64.eu.35425: Flags [P.], seq 1642883524:1642883592, ack 1651696007, win 507, options [nop,nop,TS val 3936463473 ecr 362333020], length 68
05:26:17.495984 IP 148.ip-92-222-64.eu.35425 > 10.20.0.5.ssh: Flags [.], ack 68, win 262, options [nop,nop,TS val 362353394 ecr 3936463473,nop,nop,sack 1 {0:68}], length 0
05:26:17.496055 IP 10.20.0.5 > 148.ip-92-222-64.eu: ICMP 10.20.0.5 tcp port ssh unreachable, length 72
05:26:17.590647 IP 159.89.112.251.ssh > 119.61.19.84.40556: Flags [F.], seq 1498, ack 715, win 507, options [nop,nop,TS val 719025715 ecr 64661937], length 0
05:26:17.743973 IP 119.61.19.84.40556 > 159.89.112.251.ssh: Flags [F.], seq 714, ack 1498, win 131, options [nop,nop,TS val 64662116 ecr 719025156], length 0
05:26:17.744031 IP 159.89.112.251.ssh > 119.61.19.84.40556: Flags [.], ack 715, win 507, options [nop,nop,TS val 719025868 ecr 64662116,nop,nop,sack 1 {714:715}], length 0
05:26:17.806214 IP 148.ip-92-222-64.eu.35425 > 10.20.0.5.ssh: Flags [FP.], seq 1:53, ack 68, win 262, options [nop,nop,TS val 362353472 ecr 3936463473], length 52
05:26:17.806281 IP 10.20.0.5 > 148.ip-92-222-64.eu: ICMP 10.20.0.5 tcp port ssh unreachable, length 112
05:26:17.814601 IP 159.89.112.251.ssh > 81.161.63.251.21056: Flags [P.], seq 1482:1534, ack 1193, win 503, options [nop,nop,TS val 3034899177 ecr 143648330], length 52
05:26:17.821422 IP 119.61.19.84.40556 > 159.89.112.251.ssh: Flags [.], ack 1499, win 131, options [nop,nop,TS val 64662135 ecr 719025715], length 0
05:26:17.937161 IP 81.161.63.251.21056 > 159.89.112.251.ssh: Flags [.], ack 1534, win 66, options [nop,nop,TS val 143649970 ecr 3034899177,nop,nop,sack 1 {1482:1534}], length 0
05:26:17.937229 IP 159.89.112.251 > 81.161.63.251: ICMP 159.89.112.251 tcp port ssh unreachable, length 72
05:26:19.084178 IP 81.161.63.251.21056 > 159.89.112.251.ssh: Flags [F.], seq 1193, ack 1534, win 66, options [nop,nop,TS val 143650256 ecr 3034899177], length 0
05:26:19.084259 IP 159.89.112.251 > 81.161.63.251: ICMP 159.89.112.251 tcp port ssh unreachable, length 60
05:26:19.224927 IP 45.146.165.153.53195 > 10.20.0.5.31151: Flags [S], seq 896983407, win 1024, length 0
05:26:20.726674 IP 159.89.112.251.ssh > 81.161.63.251.21056: Flags [P.], seq 1482:1534, ack 1193, win 503, options [nop,nop,TS val 3034902089 ecr 143648330], length 52
05:26:20.849212 IP 81.161.63.251.21056 > 159.89.112.251.ssh: Flags [.], ack 1534, win 66, options [nop,nop,TS val 143650698 ecr 3034902089,nop,nop,sack 1 {1482:1534}], length 0
05:26:20.849283 IP 159.89.112.251 > 81.161.63.251: ICMP 159.89.112.251 tcp port ssh unreachable, length 72
05:26:26.358693 IP 159.89.112.251.ssh > 81.161.63.251.21056: Flags [P.], seq 1482:1534, ack 1193, win 503, options [nop,nop,TS val 3034907721 ecr 143648330], length 52
05:26:26.481380 IP 81.161.63.251.21056 > 159.89.112.251.ssh: Flags [.], ack 1534, win 66, options [nop,nop,TS val 143652106 ecr 3034907721,nop,nop,sack 1 {1482:1534}], length 0
05:26:26.481461 IP 159.89.112.251 > 81.161.63.251: ICMP 159.89.112.251 tcp port ssh unreachable, length 72
05:26:27.010088 IP ip-45-74-123-101.user.start.ca.65237 > 10.20.0.5.ssh: Flags [P.], seq 1:37, ack 188, win 9943, length 36
05:26:27.010347 IP 10.20.0.5.ssh > ip-45-74-123-101.user.start.ca.65237: Flags [P.], seq 188:224, ack 37, win 501, length 36
05:26:27.082207 IP ip-45-74-123-101.user.start.ca.65237 > 10.20.0.5.ssh: Flags [.], ack 224, win 9943, length 0
05:26:27.150350 IP ip-45-74-123-101.user.start.ca.65237 > 10.20.0.5.ssh: Flags [P.], seq 37:73, ack 224, win 9943, length 36
05:26:27.150772 IP 10.20.0.5.ssh > ip-45-74-123-101.user.start.ca.65237: Flags [P.], seq 224:260, ack 73, win 501, length 36
05:26:27.211662 IP ip-45-74-123-101.user.start.ca.65237 > 10.20.0.5.ssh: Flags [.], ack 260, win 9943, length 0
05:26:27.511076 IP ip-45-74-123-101.user.start.ca.65237 > 10.20.0.5.ssh: Flags [P.], seq 73:109, ack 260, win 9943, length 36
05:26:27.511363 IP 10.20.0.5.ssh > ip-45-74-123-101.user.start.ca.65237: Flags [P.], seq 260:296, ack 109, win 501, length 36
05:26:27.582240 IP ip-45-74-123-101.user.start.ca.65237 > 10.20.0.5.ssh: Flags [.], ack 296, win 9943, length 0
05:26:27.621785 IP ip-45-74-123-101.user.start.ca.65237 > 10.20.0.5.ssh: Flags [P.], seq 109:145, ack 296, win 9943, length 36
05:26:27.622073 IP 10.20.0.5.ssh > ip-45-74-123-101.user.start.ca.65237: Flags [P.], seq 296:332, ack 145, win 501, length 36
05:26:27.683011 IP ip-45-74-123-101.user.start.ca.65237 > 10.20.0.5.ssh: Flags [.], ack 332, win 9942, length 0
05:26:27.865686 IP ip-45-74-123-101.user.start.ca.65237 > 10.20.0.5.ssh: Flags [P.], seq 145:181, ack 332, win 9942, length 36
05:26:27.865951 IP 10.20.0.5.ssh > ip-45-74-123-101.user.start.ca.65237: Flags [P.], seq 332:368, ack 181, win 501, length 36
05:26:27.929677 IP ip-45-74-123-101.user.start.ca.65237 > 10.20.0.5.ssh: Flags [.], ack 368, win 9942, length 0
05:26:28.041352 IP ip-45-74-123-101.user.start.ca.65237 > 10.20.0.5.ssh: Flags [P.], seq 181:217, ack 368, win 9942, length 36
05:26:28.041660 IP 10.20.0.5.ssh > ip-45-74-123-101.user.start.ca.65237: Flags [P.], seq 368:404, ack 217, win 501, length 36
05:26:28.114824 IP ip-45-74-123-101.user.start.ca.65237 > 10.20.0.5.ssh: Flags [.], ack 404, win 9942, length 0
05:26:31.759173 IP 59.83.222.82.40452 > 10.20.0.5.ssh: Flags [P.], seq 1:53, ack 68, win 154, options [nop,nop,TS val 793321154 ecr 3117604367], length 52
05:26:31.759248 IP 10.20.0.5 > 59.83.222.82: ICMP 10.20.0.5 tcp port ssh unreachable, length 112
05:26:37.366649 IP 159.89.112.251.ssh > 81.161.63.251.21056: Flags [P.], seq 1482:1534, ack 1193, win 503, options [nop,nop,TS val 3034918729 ecr 143648330], length 52
05:26:37.490034 IP 81.161.63.251.21056 > 159.89.112.251.ssh: Flags [.], ack 1534, win 66, options [nop,nop,TS val 143654858 ecr 3034918729,nop,nop,sack 1 {1482:1534}], length 0
05:26:37.490140 IP 159.89.112.251 > 81.161.63.251: ICMP 159.89.112.251 tcp port ssh unreachable, length 72
05:26:41.974670 IP 10.20.0.5.ssh > 59.83.222.82.40452: Flags [P.], seq 0:68, ack 1, win 507, options [nop,nop,TS val 3117630735 ecr 793276461], length 68
05:26:42.305312 IP 59.83.222.82.40452 > 10.20.0.5.ssh: Flags [.], ack 68, win 154, options [nop,nop,TS val 793331699 ecr 3117630735,nop,nop,sack 1 {0:68}], length 0
05:26:42.305392 IP 10.20.0.5 > 59.83.222.82: ICMP 10.20.0.5 tcp port ssh unreachable, length 72
05:26:42.461387 IP 111.62.22.88.47166 > 10.20.0.5.6379: Flags [S], seq 4131397890, win 29200, options [mss 1460,sackOK,TS val 3987060747 ecr 0,nop,wscale 7], length 0
05:26:44.378417 IP scanner.openportstats.com.58669 > 10.20.0.5.9700: Flags [S], seq 4218349005, win 1024, length 0
05:26:46.210681 IP 194.147.140.96.52560 > 10.20.0.5.3105: Flags [S], seq 2394579770, win 1024, length 0