root@lamp-ubuntu-s-1vcpu-1gb-tor1-01:~# tcpdump -n -i eth0
tcpdump: verbose output suppressed, use -v or -vv for full protocol decode
listening on eth0, link-type EN10MB (Ethernet), capture size 262144 bytes
05:29:50.790336 IP 10.20.0.5.22 > 45.74.123.101.65237: Flags [P.], seq 3501525723:3501525831, ack 1245865389, win 501, length 108
05:29:50.790453 IP 10.20.0.5.22 > 45.74.123.101.65237: Flags [P.], seq 108:144, ack 1, win 501, length 36
05:29:50.790643 IP 10.20.0.5.22 > 45.74.123.101.65237: Flags [P.], seq 144:252, ack 1, win 501, length 108
05:29:50.790731 IP 10.20.0.5.22 > 45.74.123.101.65237: Flags [P.], seq 252:288, ack 1, win 501, length 36
05:29:50.790985 IP 10.20.0.5.22 > 45.74.123.101.65237: Flags [P.], seq 288:452, ack 1, win 501, length 164
05:29:50.791083 IP 10.20.0.5.22 > 45.74.123.101.65237: Flags [P.], seq 452:488, ack 1, win 501, length 36
05:29:50.791198 IP 10.20.0.5.22 > 45.74.123.101.65237: Flags [P.], seq 488:628, ack 1, win 501, length 140
05:29:50.791286 IP 10.20.0.5.22 > 45.74.123.101.65237: Flags [P.], seq 628:664, ack 1, win 501, length 36
05:29:50.791396 IP 10.20.0.5.22 > 45.74.123.101.65237: Flags [P.], seq 664:804, ack 1, win 501, length 140
05:29:50.819465 IP 45.74.123.101.65237 > 10.20.0.5.22: Flags [.], ack 108, win 9941, length 0
05:29:50.819545 IP 10.20.0.5.22 > 45.74.123.101.65237: Flags [P.], seq 804:1896, ack 1, win 501, length 1092
05:29:50.819576 IP 45.74.123.101.65237 > 10.20.0.5.22: Flags [.], ack 664, win 9944, length 0
05:29:50.819591 IP 45.74.123.101.65237 > 10.20.0.5.22: Flags [.], ack 804, win 9944, length 0
05:29:50.819807 IP 10.20.0.5.22 > 45.74.123.101.65237: Flags [P.], seq 1896:2028, ack 1, win 501, length 132
05:29:50.819923 IP 10.20.0.5.22 > 45.74.123.101.65237: Flags [P.], seq 2028:2064, ack 1, win 501, length 36
05:29:50.820077 IP 10.20.0.5.22 > 45.74.123.101.65237: Flags [P.], seq 2064:2212, ack 1, win 501, length 148
05:29:50.820219 IP 10.20.0.5.22 > 45.74.123.101.65237: Flags [P.], seq 2212:2248, ack 1, win 501, length 36
05:29:50.820450 IP 10.20.0.5.22 > 45.74.123.101.65237: Flags [P.], seq 2248:2380, ack 1, win 501, length 132
05:29:50.820690 IP 10.20.0.5.22 > 45.74.123.101.65237: Flags [P.], seq 2380:2416, ack 1, win 501, length 36
05:29:50.820940 IP 10.20.0.5.22 > 45.74.123.101.65237: Flags [P.], seq 2416:2548, ack 1, win 501, length 132
05:29:50.821177 IP 10.20.0.5.22 > 45.74.123.101.65237: Flags [P.], seq 2548:2584, ack 1, win 501, length 36
05:29:50.821411 IP 10.20.0.5.22 > 45.74.123.101.65237: Flags [P.], seq 2584:2732, ack 1, win 501, length 148