05:32:51.200180 IP 10.20.0.5.ssh > ip-45-74-123-101.user.start.ca.65237: Flags [P.], seq 1369412:1370056, ack 721, win 501, length 644
05:32:51.200318 IP 10.20.0.5.ssh > ip-45-74-123-101.user.start.ca.65237: Flags [P.], seq 1370056:1370228, ack 721, win 501, length 172
05:32:51.200440 IP 10.20.0.5.ssh > ip-45-74-123-101.user.start.ca.65237: Flags [P.], seq 1370228:1370400, ack 721, win 501, length 172
05:32:51.200590 IP 10.20.0.5.ssh > ip-45-74-123-101.user.start.ca.65237: Flags [P.], seq 1370400:1370572, ack 721, win 501, length 172
05:32:51.200717 IP 10.20.0.5.ssh > ip-45-74-123-101.user.start.ca.65237: Flags [P.], seq 1370572:1370744, ack 721, win 501, length 172
05:32:51.200841 IP 10.20.0.5.ssh > ip-45-74-123-101.user.start.ca.65237: Flags [P.], seq 1370744:1370916, ack 721, win 501, length 172
05:32:51.200974 IP 10.20.0.5.ssh > ip-45-74-123-101.user.start.ca.65237: Flags [P.], seq 1370916:1371088, ack 721, win 501, length 172
05:32:51.201095 IP 10.20.0.5.ssh > ip-45-74-123-101.user.start.ca.65237: Flags [P.], seq 1371088:1371260, ack 721, win 501, length 172
05:32:51.201221 IP 10.20.0.5.ssh > ip-45-74-123-101.user.start.ca.65237: Flags [P.], seq 1371260:1371432, ack 721, win 501, length 172
05:32:51.201349 IP 10.20.0.5.ssh > ip-45-74-123-101.user.start.ca.65237: Flags [P.], seq 1371432:1371604, ack 721, win 501, length 172
05:32:51.201466 IP 10.20.0.5.ssh > ip-45-74-123-101.user.start.ca.65237: Flags [P.], seq 1371604:1371776, ack 721, win 501, length 172
05:32:51.201582 IP 10.20.0.5.ssh > ip-45-74-123-101.user.start.ca.65237: Flags [P.], seq 1371776:1371948, ack 721, win 501, length 172
05:32:51.201712 IP 10.20.0.5.ssh > ip-45-74-123-101.user.start.ca.65237: Flags [P.], seq 1371948:1372120, ack 721, win 501, length 172
05:32:51.201829 IP 10.20.0.5.ssh > ip-45-74-123-101.user.start.ca.65237: Flags [P.], seq 1372120:1372292, ack 721, win 501, length 172
05:32:51.201962 IP 10.20.0.5.ssh > ip-45-74-123-101.user.start.ca.65237: Flags [P.], seq 1372292:1372464, ack 721, win 501, length 172
05:32:51.202081 IP 10.20.0.5.ssh > ip-45-74-123-101.user.start.ca.65237: Flags [P.], seq 1372464:1372636, ack 721, win 501, length 172
05:32:51.202198 IP 10.20.0.5.ssh > ip-45-74-123-101.user.start.ca.65237: Flags [P.], seq 1372636:1372808, ack 721, win 501, length 172
05:32:51.202386 IP 10.20.0.5.ssh > ip-45-74-123-101.user.start.ca.65237: Flags [P.], seq 1372808:1372980, ack 721, win 501, length 172
05:32:51.202596 IP 10.20.0.5.ssh > ip-45-74-123-101.user.start.ca.65237: Flags [P.], seq 1372980:1373152, ack 721, win 501, length 172
05:32:51.202741 IP 10.20.0.5.ssh > ip-45-74-123-101.user.start.ca.65237: Flags [P.], seq 1373152:1373324, ack 721, win 501, length 172
05:32:51.202869 IP 10.20.0.5.ssh > ip-45-74-123-101.user.start.ca.65237: Flags [P.], seq 1373324:1373496, ack 721, win 501, length 172
05:32:51.202993 IP 10.20.0.5.ssh > ip-45-74-123-101.user.start.ca.65237: Flags [P.], seq 1373496:1373668, ack 721, win 501, length 172
05:32:51.203118 IP 10.20.0.5.ssh > ip-45-74-123-101.user.start.ca.65237: Flags [P.], seq 1373668:1373840, ack 721, win 501, length 172
05:32:51.203244 IP 10.20.0.5.ssh > ip-45-74-123-101.user.start.ca.65237: Flags [P.], seq 1373840:1374012, ack 721, win 501, length 172
05:32:51.203364 IP 10.20.0.5.ssh > ip-45-74-123-101.user.start.ca.65237: Flags [P.], seq 1374012:1374184, ack 721, win 501, length 172
05:32:51.203480 IP 10.20.0.5.ssh > ip-45-74-123-101.user.start.ca.65237: Flags [P.], seq 1374184:1374356, ack 721, win 501, length 172
05:32:51.203598 IP 10.20.0.5.ssh > ip-45-74-123-101.user.start.ca.65237: Flags [P.], seq 1374356:1374528, ack 721, win 501, length 172
05:32:51.203715 IP 10.20.0.5.ssh > ip-45-74-123-101.user.start.ca.65237: Flags [P.], seq 1374528:1374700, ack 721, win 501, length 172
05:32:51.203831 IP 10.20.0.5.ssh > ip-45-74-123-101.user.start.ca.65237: Flags [P.], seq 1374700:1374872, ack 721, win 501, length 172
^C
8080 packets captured
8083 packets received by filter
0 packets dropped by kernel